CATEGORY,SUBCATEGORY,AGE,TIMEALLOWED,REGION,QUESTION,ANSWER1,ANSWER2,ANSWER3,ANSWER4,HINT,CORRECTANSWER,IMAGEURL,VIDEOURL,SOUNDURL,FILETYPE,questionMasterId ,status,creditBy,questionActiveStatus,questionState
"BRANDS, BUSINESS & TECHNOLOGY",NONE,"TEEN,ADULT",30,United States,A 'friseur' is an old-fashioned term for which occupation?,Hairdresser,Chef,Butler,Farmer,(NULL),A,,,,0,136377,0,,1,1
"BRANDS, BUSINESS & TECHNOLOGY",NONE,"TEEN,ADULT",30,United States,A phrenologist used to feel which part of your body to diagnose illness?,Hands,Feet,Head,Stomach,(NULL),C,,,,0,136385,0,,1,1
ENTERTAINMENT,NONE,"TEEN,ADULT",30,United States,A 'rikishi' takes part in which sport?,Judo,Sumo wrestling,Tae Kwon Do,Brazilian jiu-jitsu,(NULL),B,,,,0,136393,0,,1,1
"BRANDS, BUSINESS & TECHNOLOGY",NONE,"TEEN,ADULT",30,United States,A 'susohiki' is a traditional garment from which country?,Thailand,Japan,Mongolia,South Korea,(NULL),B,,,,0,136401,0,,1,1
"BRANDS, BUSINESS & TECHNOLOGY",NONE,"TEEN,ADULT",30,United States,A tap in the UK is called what in the US?,Tap,Faucet,Sprinkler,Water Pipe,(NULL),B,,,,0,136409,0,,1,1
ENTERTAINMENT,NONE,"TEEN,ADULT",30,United States,A toxophilite is an expert in which sport?,Golf,Clay pigeon shooting,Archery,Horse riding,(NULL),C,,,,0,136417,0,,1,1
"BRANDS, BUSINESS & TECHNOLOGY",NONE,"TEEN,ADULT",30,United States,A 'warder' would have worked in which sort of building?,Church,Prison,Palace,Hospital,(NULL),B,,,,0,136425,0,,1,1
"BRANDS, BUSINESS & TECHNOLOGY",NONE,"TEEN,ADULT",30,United States,A' yeoman' was someone working in which profession?,Printing,Medicine,Textiles,Farming,(NULL),D,,,,0,136433,0,,1,1
SPORTS & LEISURE,NONE,"TEEN,ADULT",30,United States,"According to conspiracy theorists, what city's gnomes control the world economy?",Zurich,London,Vatican,New York,(NULL),A,,,,0,136441,0,,1,1
ENTERTAINMENT,NONE,"TEEN,ADULT",30,United States,"According to Spalding, what is the average life of an official NBA ball in bounces?","100,000","1,000,000","10,000","1,000",(NULL),C,,,,0,136449,0,,1,1
SPOOKY Halloween,NONE,"TEEN,ADULT",30,United States,"According to the meme, who is ""overly attached""?",Boyfriend,Wife,Girlfriend,Husband,(NULL),C,,,,0,136457,0,,1,1
SCIENCE & NATURE,NONE,"TEEN,ADULT",30,United States,Actor Oliver Martinez married what actress in 2013?,Cate Blanchett,Kate Hudson,Halle Berry,Cameron Diaz,(NULL),C,,,,0,136465,0,,1,1
SPORTS & LEISURE,NONE,"TEEN,ADULT",30,United States,Akbar the Great ruled over which empire?,Gupta,Mughal,Maratha,Kushan,(NULL),B,,,,0,136473,0,,1,1
SCIENCE & NATURE,NONE,"TEEN,ADULT",30,United States,Alec Baldwin won the Emmy for 'Best Actor - Comedy Series' twice for which TV show?,Arrested Development,30 Rock,Curb Your Enthusiasm,Frasier,(NULL),B,,,,0,136481,0,,1,1
SCIENCE & NATURE,NONE,"TEEN,ADULT",30,United States,Alec Hardy is a character in which British TV mini-series?,Happy Valley,Broadchurch,Luther,Bodyguard,(NULL),B,,,,0,136489,0,,1,1
LIFESTYLE & CULTURE,NONE,"TEEN,ADULT",30,United States,An agouti is what type of animal?,Snake,Lizard,Rodent,Monkey,(NULL),C,,,,0,136497,0,,1,1
"BRANDS, BUSINESS & TECHNOLOGY",NONE,"TEEN,ADULT",30,United States,An Indian Hindu bride traditionally wears what colour saree?,Gold,Black,Red,White,(NULL),C,,,,0,136505,0,,1,1
ENTERTAINMENT,NONE,"TEEN,ADULT",30,United States,An official marathon is 385 yards and how many miles?,26,24,22,28,(NULL),A,,,,0,136513,0,,1,1
"BRANDS, BUSINESS & TECHNOLOGY",NONE,"TEEN,ADULT",30,United States,Ancient Egyptians used the dung of what animal as a contraceptive?,Cats,Crocodile,Asps,Baboons,(NULL),B,,,,0,136521,0,,1,1
LIFESTYLE & CULTURE,NONE,"TEEN,ADULT",30,United States,Apache and Inca Dawn are types of what?,Apple,Potato,Banana,Plum,(NULL),B,,,,0,136529,0,,1,1
LIFESTYLE & CULTURE,NONE,"TEEN,ADULT",30,United States,"Approximately, how old is the sun?","45,000 years",4.5 billion years,4.5 million years,45 million years,(NULL),B,,,,0,136537,0,,1,1
SPORTS & LEISURE,NONE,"TEEN,ADULT",30,United States,"Approximately, what is the population of Norway?",1 million,15 million,17 million,5 million,(NULL),D,,,,0,136545,0,,1,1
"BRANDS, BUSINESS & TECHNOLOGY",NONE,"TEEN,ADULT",30,United States,"As well as tuna, which fish is used in a Salade Nicoise?",White Bait,Pilchards,Anchovies,Sardines,(NULL),C,,,,0,136553,0,,1,1
LIFESTYLE & CULTURE,NONE,"TEEN,ADULT",30,United States,Aspirin derives from which tree?,Hazel,Yew,Willow,Ash,(NULL),C,,,,0,136561,0,,1,1
LIFESTYLE & CULTURE,NONE,"TEEN,ADULT",30,United States,Asteroids are mainly made of what?,Dust,Ice,Water,Rock,(NULL),D,,,,0,136569,0,,1,1
ENTERTAINMENT,NONE,"TEEN,ADULT",30,United States,At what age did Boris Becker win Wimbledon for the first time?,19,17,21,25,(NULL),B,,,,0,136577,0,,1,1
SPOOKY Halloween,NONE,"TEEN,ADULT",30,United States,At what age did eBay founder Pierre Omidyar become a billionaire?,31,35,22,18,(NULL),A,,,,0,136585,0,,1,1
ENTERTAINMENT,NONE,"TEEN,ADULT",30,United States,Athlete Wilson Kipketer switched nationality from Kenyan to which nation?,United Arab Emirates,Germany,Qatar,Denmark,(NULL),D,,,,0,136593,0,,1,1
SCIENCE & NATURE,NONE,"TEEN,ADULT",30,United States,Baby' and 'Foolish' are hits from which 'princess'?,Jennifer Lopez,Brandy,Ashanti,Charli Baltimore,(NULL),C,,,,0,136601,0,,1,1
ENTERTAINMENT,NONE,"TEEN,ADULT",30,United States,Ben Ainslie is a multi-Olympic medalist in which sport?,Diving,Archery,Sailing,Table Tennis,(NULL),C,,,,0,136609,0,,1,1
SPORTS & LEISURE,NONE,"TEEN,ADULT",30,United States,"Between June 2010 and December 2011, which country had no official government?",France,Germany,Italy,Belgium,(NULL),D,,,,0,136617,0,,1,1
SPOOKY Halloween,NONE,"TEEN,ADULT",30,United States,Bonnie Zacherle invented which famous girls toy in 1981?,Cabbage Patch Kids,Barbie Doll,My Little Pony,Bratz Dolls,(NULL),C,,,,0,136625,0,,1,1
ENTERTAINMENT,NONE,"TEEN,ADULT",30,United States,Boxer Manny Pacquiao comes from which country?,Philippines,Indonesia,Mexico,Spain,(NULL),A,,,,0,136633,0,,1,1
SCIENCE & NATURE,NONE,"TEEN,ADULT",30,United States,Brandy and Monica sang what hit song that stayed at number one for 13 weeks?,Full Moon,Waterfalls,The Boy Is Mine,Are You That Somebody,(NULL),C,,,,0,136641,0,,1,1
LIFESTYLE & CULTURE,NONE,"TEEN,ADULT",30,United States,Buddha is said to have obtained enlightenment under which tree?,The Fig Tree,The Mango Tree,The Cypress Tree,The Pine Tree,(NULL),A,,,,0,136649,0,,1,1
ENTERTAINMENT,NONE,"TEEN,ADULT",30,United States,"By 2015, who was the only footballer to have won the FIFA Ballon D'Or four times?",Lionel Messi,David Beckham,Cristiano Ronaldo,Pele,(NULL),A,,,,0,136657,0,,1,1
SCIENCE & NATURE,NONE,"TEEN,ADULT",30,United States,Can't Fight the Moonlight' was sung by whom in Coyote Ugly?,Carrie Underwood,Taylor Swift,Leann Rimes,Shania Twain,(NULL),C,,,,0,136665,0,,1,1
SPOOKY Halloween,NONE,"TEEN,ADULT",30,United States,"Capri Sun, produced by Capri Sun Group Holding, is based out of which country?",Austria,Germany,France,Spain,(NULL),B,,,,0,136673,0,,1,1
ENTERTAINMENT,NONE,"TEEN,ADULT",30,United States,Carl Lewis is one of the all-time great Olympians. Which of these was NOT one of his events?,Long jump,Triple jump,200m,100m,(NULL),B,,,,0,136681,0,,1,1
LIFESTYLE & CULTURE,NONE,"TEEN,ADULT",30,United States,Caviar traditionally comes from which fish?,Tuna,Trout,Sturgeon,Cod,(NULL),C,,,,0,136689,0,,1,1
"BRANDS, BUSINESS & TECHNOLOGY",NONE,"TEEN,ADULT",30,United States,Cavolo Nero is a type of which vegetable?,Cabbage,Cauliflower,Leek,Spinach,(NULL),A,,,,0,136697,0,,1,1
ENTERTAINMENT,NONE,"TEEN,ADULT",30,United States,Chicago Cubs and St Louis Cardinals play which sport?,Basketball,Baseball,American football,Ice hockey,(NULL),B,,,,0,136705,0,,1,1
"BRANDS, BUSINESS & TECHNOLOGY",NONE,"TEEN,ADULT",30,United States,Citroen cars originate from which country?,France,Germany,The Netherlands,Belgium,(NULL),A,,,,0,136713,0,,1,1
SCIENCE & NATURE,NONE,"TEEN,ADULT",30,United States,Complete the title of an S Club 7 Number 1 'Never had a _____'?,Girl Like You,Love Like This,Boy Who Knows,Dream Come True,(NULL),D,,,,0,136721,0,,1,1
SCIENCE & NATURE,NONE,"TEEN,ADULT",30,United States,Complete the title of the 2004 Romance: 'Before ___'?,Sunrise,Moonlight,Sunset,Anything,(NULL),C,,,,0,136729,0,,1,1
"BRANDS, BUSINESS & TECHNOLOGY",NONE,"TEEN,ADULT",30,United States,Cooking "en papillote" involves wrapping food in what?,Leaves,Foil,Paper,Corn husks,(NULL),C,,,,0,136737,0,,1,1
ENTERTAINMENT,NONE,"TEEN,ADULT",30,United States,Cricket is believed to have first been played in which century?,17th,19th,16th,18th,(NULL),C,,,,0,136745,0,,1,1
SCIENCE & NATURE,NONE,"TEEN,ADULT",30,United States,Darren Le Gallo is the husband of which movie star?,Anna Farris,Taylor Schilling,Zooey Deschanel,Amy Adams,(NULL),D,,,,0,136753,0,,1,1
ENTERTAINMENT,NONE,"TEEN,ADULT",30,United States,"Detroit Red Wings, New York Rangers and Boston Bruins play which sport?",Basketball,Baseball,American Football,Ice hockey,(NULL),D,,,,0,136761,0,,1,1
LIFESTYLE & CULTURE,NONE,"TEEN,ADULT",30,United States,DNA is used to create what?,Proteins,Lipids,Carbohydrates,Nerves,(NULL),A,,,,0,136769,0,,1,1
SCIENCE & NATURE,NONE,"TEEN,ADULT",30,United States,Donnie Wahlberg was a former member of which boyband?,Nsync,New Kids On The Block,O-Town,Take That,(NULL),B,,,,0,136777,0,,1,1
SCIENCE & NATURE,NONE,"TEEN,ADULT",30,United States,Drew Barrymore married what comedy star in 2001?,Jim Carrey,Tom Green,Ben Stiller,Johnny Knoxville,(NULL),B,,,,0,136785,0,,1,1
SCIENCE & NATURE,NONE,"TEEN,ADULT",30,United States,Drew Lachey was a former member of which boyband?,Westlife,B2K,Five,98 Degrees,(NULL),D,,,,0,136793,0,,1,1
SCIENCE & NATURE,NONE,"TEEN,ADULT",30,United States,Early in their career Destiny's Child recorded the song 'Killing Time' for which film soundtrack?,Men In Black,Independence Day,The Matrix,Mars Attacks,(NULL),A,,,,0,136801,0,,1,1
SCIENCE & NATURE,NONE,"TEEN,ADULT",30,United States,Eazy-Duz-It is an album from which hip hop group?,Beatie Boys,NWA,Onyx,Fugees,(NULL),B,,,,0,136809,0,,1,1
ENTERTAINMENT,NONE,"TEEN,ADULT",30,United States,Edson Arantes do Nascimento is better known by which name?,Neymar,Pele,Ronaldinho,Ronaldo,(NULL),B,,,,0,136817,0,,1,1
SCIENCE & NATURE,NONE,"TEEN,ADULT",30,United States,Elvis Costello sang the song 'She' for the soundtrack of which film?,The King's Speech,Love Actually,Four Weddings and a Funeral,Notting Hill,(NULL),D,,,,0,136825,0,,1,1
SCIENCE & NATURE,NONE,"TEEN,ADULT",30,United States,Emilia Clarke stars in which TV show?,The Crown,Game of Thrones,The Handmaid's Tale,Big Bang Theory,(NULL),B,,,,0,136833,0,,1,1
SPOOKY Halloween,NONE,"TEEN,ADULT",30,United States,"Entrepreneur Alexis Ohanian, co-founder and executive chairman of social media site Reddit, is married to which sports star?",Simone Biles,Maria Sharapova,Caroline Wozniacki,Serena Williams,(NULL),D,,,,0,136841,0,,1,1
SPOOKY Halloween,NONE,"TEEN,ADULT",30,United States,Entrepreneur Henry Ford set up his first car factory in which US state?,Michigan,Maine,Illinois,Ohio,(NULL),A,,,,0,136849,0,,1,1
LIFESTYLE & CULTURE,NONE,"TEEN,ADULT",30,United States,Epilation is the removal of what?,Skin,Nails,Hair,Teeth,(NULL),C,,,,0,136857,0,,1,1
"BRANDS, BUSINESS & TECHNOLOGY",NONE,"TEEN,ADULT",30,United States,Eurotophobia is a fear of what?,Male genitals,Female genitals,Bodily fluids,Venereal diseases,(NULL),B,,,,0,136865,0,,1,1
SCIENCE & NATURE,NONE,"TEEN,ADULT",30,United States,Evanescence's 'Bring Me To Life' featured in which film?,Flash Gordon,Daredevil,Spiderman,Green Lantern,(NULL),B,,,,0,136873,0,,1,1
ENTERTAINMENT,NONE,"TEEN,ADULT",30,United States,Famous racehorse Shergar was stolen in which year?,1983,1980,1988,1977,(NULL),A,,,,0,136881,0,,1,1
ENTERTAINMENT,NONE,"TEEN,ADULT",30,United States,Fans of which English rugby union team wear fez hats?,Harlequins,Saracens,Wasps,Bath,(NULL),B,,,,0,136889,0,,1,1
SCIENCE & NATURE,NONE,"TEEN,ADULT",30,United States,Felicity Huffman is married to what actor?,William Hurt,William H. Macy,Kevin Kline,Steve Buscemi,(NULL),B,,,,0,136897,0,,1,1
ENTERTAINMENT,NONE,"TEEN,ADULT",30,United States,Ferenc Puskas was a famous footballer from which country?,Romania,Czech Republic,Hungary,Poland,(NULL),C,,,,0,136905,0,,1,1
SPORTS & LEISURE,NONE,"TEEN,ADULT",30,United States,Fjords are found in which country?,Iceland,Norway,Finland,The Netherlands,(NULL),B,,,,0,136913,0,,1,1
SPORTS & LEISURE,NONE,"TEEN,ADULT",30,United States,"Following pressure from the ANC, Thabo Mbeki stepped down as the President of which country?",Ghana,Zimbabwe,South Africa,Namibia,(NULL),C,,,,0,136921,0,,1,1
ENTERTAINMENT,NONE,"TEEN,ADULT",30,United States,"Formula One driver, Kimi Raikkonen, comes from which country?",Finland,Sweden,Norway,Germany,(NULL),A,,,,0,136929,0,,1,1
SCIENCE & NATURE,NONE,"TEEN,ADULT",30,United States,Four Weddings and Funeral was released in which year?,1998,1992,1994,1990,(NULL),C,,,,0,136937,0,,1,1
SPOOKY Halloween,NONE,"TEEN,ADULT",30,United States,Fred DeLuca founded which fast food outlet?,Subway,McDonalds,Burger King,Pizza Hut,(NULL),A,,,,0,136945,0,,1,1
"BRANDS, BUSINESS & TECHNOLOGY",NONE,"TEEN,ADULT",30,United States,"From which country did the cold oatmeal dish, muesli originate?",Germany,Sweden,New Zealand,Switzerland,(NULL),D,,,,0,136953,0,,1,1
"BRANDS, BUSINESS & TECHNOLOGY",NONE,"TEEN,ADULT",30,United States,From which country does car manufacturer Skoda originate?,Germany,Czech Republic,Sweden,Slovakia,(NULL),B,,,,0,136961,0,,1,1
SCIENCE & NATURE,NONE,"TEEN,ADULT",30,United States,From which planet does Spock come from in 'Star Trek'?,Romulus,Earth,Saturn,Vulcan,(NULL),D,,,,0,136969,0,,1,1
"BRANDS, BUSINESS & TECHNOLOGY",NONE,"TEEN,ADULT",30,United States,Galaxy Truffles were removed from which boxed chocolates in 2011?,Celebrations,Matchmakers,Black Magic,All Gold,(NULL),A,,,,0,136977,0,,1,1
SCIENCE & NATURE,NONE,"TEEN,ADULT",30,United States,Gary is the pet snail of which cartoon character?,Peter Griffin,Bart Simpson,SpongeBob SquarePants,Hank Hill,(NULL),C,,,,0,136985,0,,1,1
SPORTS & LEISURE,NONE,"TEEN,ADULT",30,United States,German city Dresden lies on which river?,Danube,Seine,Rhine,Elbe,(NULL),D,,,,0,136993,0,,1,1
ENTERTAINMENT,NONE,"TEEN,ADULT",30,United States,"German swimmer, Kristin Otto, won six gold medals at which Olympics?",Barcelona,Atlanta,Seoul,Beijing,(NULL),C,,,,0,137001,0,,1,1
LIFESTYLE & CULTURE,NONE,"TEEN,ADULT",30,United States,"Globally, what is the most common breed of dog utilised by police?",German Shepherd,Airedale Terrier,Beagle,Bloodhounds,(NULL),A,,,,0,137009,0,,1,1
SPOOKY Halloween,NONE,"TEEN,ADULT",30,United States,"Guess, the American clothing line, had which celebrity endorse them?",Kristi Yamaguchi,Jay Z,Paris Hilton,Daddy Yankee,(NULL),C,,,,0,137017,0,,1,1
"BRANDS, BUSINESS & TECHNOLOGY",NONE,"TEEN,ADULT",30,United States,Hagia Sophia is an example of what architectural style?,Baroque,Byzantine,Art Noveau,Gothic,(NULL),B,,,,0,137025,0,,1,1
SCIENCE & NATURE,NONE,"TEEN,ADULT",30,United States,Halcyon is a top-selling album from which singer?,Halsey,La Roux,Pixie Lott,Ellie Goulding,(NULL),D,,,,0,137033,0,,1,1
SCIENCE & NATURE,NONE,"TEEN,ADULT",30,United States,Henry Hill goes into witness protection to testify against what mob boss in 'Goodfellas'?,Tommy DeVito,Jimmy Conway,Jimmy Two Times,Paul Cicero,(NULL),D,,,,0,137041,0,,1,1
SPOOKY Halloween,NONE,"TEEN,ADULT",30,United States,Hong Kong and which other city form the original name of HSBC bank?,Beijing,Chongqing,Hiroshima,Shanghai,(NULL),D,,,,0,137049,0,,1,1
"BRANDS, BUSINESS & TECHNOLOGY",NONE,"TEEN,ADULT",30,United States,How did artist Vincent Van Gogh die?,Drowned,Stabbed by Paul Gauguin,Heart attack,Shot himself,(NULL),D,,,,0,137057,0,,1,1
SPORTS & LEISURE,NONE,"TEEN,ADULT",30,United States,How did William II die?,In battle,Meningitis,Food poisoning,Hunting accident,(NULL),D,,,,0,137065,0,,1,1
ENTERTAINMENT,NONE,"TEEN,ADULT",30,United States,How long does it take world class race walkers to cover 1 mile?,4 minutes,8 minutes,7 minutes,6 minutes,(NULL),D,,,,0,137073,0,,1,1
LIFESTYLE & CULTURE,NONE,"TEEN,ADULT",30,United States,How long is an elephant's gestation period?,9 months,22 months,6 months,15 months,(NULL),B,,,,0,137081,0,,1,1
ENTERTAINMENT,NONE,"TEEN,ADULT",30,United States,How long is the cycling leg of an Olympic triathlon?,50km,60km,40km,25km,(NULL),C,,,,0,137089,0,,1,1
ENTERTAINMENT,NONE,"TEEN,ADULT",30,United States,How long is the run in an Olympic triathlon?,10km,5km,15km,20km,(NULL),A,,,,0,137097,0,,1,1
SPORTS & LEISURE,NONE,"TEEN,ADULT",30,United States,How long is the term for which a French President is elected?,Eight years,Five years,Seven years,Four years,(NULL),C,,,,0,137105,0,,1,1
ENTERTAINMENT,NONE,"TEEN,ADULT",30,United States,How many active players does each team have when fielding in baseball?,7,5,9,11,(NULL),C,,,,0,137113,0,,1,1
ENTERTAINMENT,NONE,"TEEN,ADULT",30,United States,How many balls are on the table at the beginning of a game of eight-ball pool?,10,16,15,11,(NULL),B,,,,0,137121,0,,1,1
LIFESTYLE & CULTURE,NONE,"TEEN,ADULT",30,United States,How many carats is 100 percent pure gold?,18,24,36,48,(NULL),B,,,,0,137129,0,,1,1
SPORTS & LEISURE,NONE,"TEEN,ADULT",30,United States,How many countries border China?,Seven,Fourteen,Five,Three,(NULL),B,,,,0,137137,0,,1,1
ENTERTAINMENT,NONE,"TEEN,ADULT",30,United States,How many countries competed in the first Summer Olympic Games in 1896?,7,14,56,28,(NULL),B,,,,0,137145,0,,1,1
ENTERTAINMENT,NONE,"TEEN,ADULT",30,United States,How many distinct poker hands are possible?,1 Million,2.5 Million,"100,000",11 Million,(NULL),B,,,,0,137153,0,,1,1
SPORTS & LEISURE,NONE,"TEEN,ADULT",30,United States,How many faces are carved into Mount Rushmore?,Six,Seven,Two,Four,(NULL),D,,,,0,137161,0,,1,1
ENTERTAINMENT,NONE,"TEEN,ADULT",30,United States,How many finger holes are there usually in a bowling ball?,Three,Two,One,Four,(NULL),A,,,,0,137169,0,,1,1
ENTERTAINMENT,NONE,"TEEN,ADULT",30,United States,How many hurdles are jumped at the Grand National?,30,25,20,15,(NULL),A,,,,0,137177,0,,1,1
SPORTS & LEISURE,NONE,"TEEN,ADULT",30,United States,How many islands make up The Bahamas?,7,70,700,7000,(NULL),C,,,,0,137185,0,,1,1
ENTERTAINMENT,NONE,"TEEN,ADULT",30,United States,How many judges are typically present at a boxing match?,Two,Three,Four,Five,(NULL),B,,,,0,137193,0,,1,1
ENTERTAINMENT,NONE,"TEEN,ADULT",30,United States,How many Majors did Jack Nicklaus win?,15,20,21,18,(NULL),D,,,,0,137201,0,,1,1
SPOOKY Halloween,NONE,"TEEN,ADULT",30,United States,How many mega pixels did the iPhone 1 camera ship with?,2.0 MP,0.5 MP,6.0 MP,5.0 MP,(NULL),A,,,,0,137209,0,,1,1
ENTERTAINMENT,NONE,"TEEN,ADULT",30,United States,How many metres is the standard sprint hurdle race for women?,110m,90m,105m,100m,(NULL),D,,,,0,137217,0,,1,1
ENTERTAINMENT,NONE,"TEEN,ADULT",30,United States,How many pawns does each player start with in chess?,Ten,Sixteen,Twelve,Eight,(NULL),D,,,,0,137225,0,,1,1
SPORTS & LEISURE,NONE,"TEEN,ADULT",30,United States,"How many people were estimated to have died in the Taiping Revolution, the bloodiest of the 19th Century?",2 million,"200,000",200 million,20 million,(NULL),D,,,,0,137233,0,,1,1
ENTERTAINMENT,NONE,"TEEN,ADULT",30,United States,How many players are there on each team in water polo?,Six,Five,Nine,Seven,(NULL),D,,,,0,137241,0,,1,1
ENTERTAINMENT,NONE,"TEEN,ADULT",30,United States,How many points is a field goal worth in American Football?,Four,Five,Six,Three,(NULL),D,,,,0,137249,0,,1,1
SPORTS & LEISURE,NONE,"TEEN,ADULT",30,United States,How many presidents preceded Abraham Lincoln?,25,20,30,15,(NULL),D,,,,0,137257,0,,1,1
SPORTS & LEISURE,NONE,"TEEN,ADULT",30,United States,How many queens have ruled France?,None,Four,Three,One,(NULL),A,,,,0,137265,0,,1,1
ENTERTAINMENT,NONE,"TEEN,ADULT",30,United States,"How many red balls are placed on the table, at the start of a game of snooker?",17,14,15,16,(NULL),C,,,,0,137273,0,,1,1
SPOOKY Halloween,NONE,"TEEN,ADULT",30,United States,"How many songs could the original iPod store, assuming an average of 5MB per song?",100,"1,000","5,000","10,000",(NULL),B,,,,0,137281,0,,1,1
ENTERTAINMENT,NONE,"TEEN,ADULT",30,United States,How many teams played in the first season of the FA Premier League?,18,20,24,22,(NULL),D,,,,0,137289,0,,1,1
ENTERTAINMENT,NONE,"TEEN,ADULT",30,United States,How many times did Pete Sampras win the men's singles at Wimbledon?,Nine,Five,Twice,Seven,(NULL),D,,,,0,137297,0,,1,1
SPORTS & LEISURE,NONE,"TEEN,ADULT",30,United States,How many US states begin with letter L?,None,Two,Three,One,(NULL),D,,,,0,137305,0,,1,1
SPORTS & LEISURE,NONE,"TEEN,ADULT",30,United States,How many yards are in a mile?,"1,920","1,520","1,760","2,000",(NULL),C,,,,0,137313,0,,1,1
SPORTS & LEISURE,NONE,"TEEN,ADULT",30,United States,How many years were there between the end of the First World War and the start of the second?,21 years,23 years,27 years,19 years,(NULL),A,,,,0,137321,0,,1,1
ENTERTAINMENT,NONE,"TEEN,ADULT",30,United States,How much does a women's shot putt weigh?,4kg,2kg,1kg,8kg,(NULL),A,,,,0,137329,0,,1,1
ENTERTAINMENT,NONE,"TEEN,ADULT",30,United States,How tall is Shaquille O'Neal?,6 ft 7 inches,7 ft 1 inch,6 ft 5 inches,6 ft 9 inches,(NULL),B,,,,0,137337,0,,1,1
SCIENCE & NATURE,NONE,"TEEN,ADULT",30,United States,"Howie D, Nick Carter and Kevin Richardson were in which group?",Backstreet Boys,Red Hot Chilli Peppers,Fifth Harmony,New Kids on the Block,(NULL),A,,,,0,137345,0,,1,1
SPOOKY Halloween,NONE,"TEEN,ADULT",30,United States,"If you were searching the internet in the late 1990s, who might you have asked?",Jeeves,Wooster,Winston,Larry,(NULL),A,,,,0,137353,0,,1,1
SPOOKY Halloween,NONE,"TEEN,ADULT",30,United States,Igor Sikorsky invented which type of transport?,Submarine,Hovercraft,Helicopter,Electric Car,(NULL),C,,,,0,137361,0,,1,1
SPOOKY Halloween,NONE,"TEEN,ADULT",30,United States,"In 1884, John Mayenberg patented the 'Cow in the Can'. What was it?",Evaporated milk,Dried milk,Condensed milk,Pasteurized Milk,(NULL),A,,,,0,137369,0,,1,1
SPOOKY Halloween,NONE,"TEEN,ADULT",30,United States,In 1919 what spring-based toy earned a patent?,Pogo Stick,Slinky,Bouncing Dog,Space Jumper,(NULL),A,,,,0,137377,0,,1,1
SPORTS & LEISURE,NONE,"TEEN,ADULT",30,United States,"In 1946, which country made the first complaint heard by the United Nations Security Council?",Israel,Iran,Poland,Sweden,(NULL),B,,,,0,137385,0,,1,1
SPORTS & LEISURE,NONE,"TEEN,ADULT",30,United States,"In 1947, where was Queen Elizabeth touring when she famously struck an admirer with her umbrella?",South Africa,Australia,Hong Kong,Canada,(NULL),A,,,,0,137393,0,,1,1
SPORTS & LEISURE,NONE,"TEEN,ADULT",30,United States,"In 1969, of which organization did Yasser Arafat become the leader?",PLO,NATO,UN,PNC,(NULL),A,,,,0,137401,0,,1,1
SPOOKY Halloween,NONE,"TEEN,ADULT",30,United States,"In 2000, internet firm AOL was acquired by which entertainment conglomerate?",Disney,Time Warner,Universal Pictures,Lionsgate,(NULL),B,,,,0,137409,0,,1,1
"BRANDS, BUSINESS & TECHNOLOGY",NONE,"TEEN,ADULT",30,United States,"In 2009, Chicago's Sears Tower, was renamed what?",Harris Tower,Willis Tower,Macys Tower,Davis Tower,(NULL),B,,,,0,137417,0,,1,1
ENTERTAINMENT,NONE,"TEEN,ADULT",30,United States,"In 2010, which country was selected to host the 2022 FIFA World Cup?",USA,Mexico,Canada,Qatar,(NULL),D,,,,0,137425,0,,1,1
ENTERTAINMENT,NONE,"TEEN,ADULT",30,United States,"In 2013, which tennis player was Boris Becker coach of?",Rafael Nadal,Roger Federer,Serena Williams,Novak Djokovic,(NULL),D,,,,0,137433,0,,1,1
SCIENCE & NATURE,NONE,"TEEN,ADULT",30,United States,"In 'Alien', what species are the aliens?",Neomorph,Vulcanmorph,Macromorph,Xenomorph,(NULL),D,,,,0,137441,0,,1,1
"BRANDS, BUSINESS & TECHNOLOGY",NONE,"TEEN,ADULT",30,United States,"In architecture, an 'acanthus' is a decorative implement in which style?",Leaf,Crown,Moon,Spiral,(NULL),A,,,,0,137449,0,,1,1
ENTERTAINMENT,NONE,"TEEN,ADULT",30,United States,"In athletics, how long is the water jump in the steeplechase?",9 feet,3 feet,12 feet,6 feet,(NULL),C,,,,0,137457,0,,1,1
SCIENCE & NATURE,NONE,"TEEN,ADULT",30,United States,"In 'Breaking Bad', which actor plays Walter?",Aaron Paul,RJ Mitte,Bryan Cranston,Dean Norris,(NULL),C,,,,0,137465,0,,1,1
ENTERTAINMENT,NONE,"TEEN,ADULT",30,United States,"In Darts, what is the second highest checkout score?",163,169,167,170,(NULL),C,,,,0,137473,0,,1,1
LIFESTYLE & CULTURE,NONE,"TEEN,ADULT",30,United States,"In medicine, muscle paralysis, increased reflex activity and hypertonia is known as what?",Spasticity,Epilepsy,Myocarditis,Myocardial infarction,(NULL),A,,,,0,137481,0,,1,1
ENTERTAINMENT,NONE,"TEEN,ADULT",30,United States,"In rugby union, where is a player sent when he is shown a yellow card?",Foul-bowl,Out-boar,Beat-seat,Sin-bin,(NULL),D,,,,0,137489,0,,1,1
ENTERTAINMENT,NONE,"TEEN,ADULT",30,United States,"In sailing, which of these classes of boats is double-hulled?",470,Laser,49er,Tornado,(NULL),D,,,,0,137497,0,,1,1
ENTERTAINMENT,NONE,"TEEN,ADULT",30,United States,"In sport, what is the controversial 'Jaked 01'?",Cricket ball,Swimsuit,F1 spoiler,Bicycle,(NULL),B,,,,0,137505,0,,1,1
SCIENCE & NATURE,NONE,"TEEN,ADULT",30,United States,"In the animated TV series, 'Family Guy', Meg Griffin is voiced by which actress?",Demi Moore,Natalie Portman,Emma Stone,Mila Kunis,(NULL),D,,,,0,137513,0,,1,1
"BRANDS, BUSINESS & TECHNOLOGY",NONE,"TEEN,ADULT",30,United States,"In the board game Cluedo, Colonel Mustard sleeps with what under his pillow every night?",Revolver,Dagger,Rope,Candlestick,(NULL),A,,,,0,137521,0,,1,1
SPOOKY Halloween,NONE,"TEEN,ADULT",30,United States,"In the first ever Internet connection test, which two US states were connected?",New York & Virginia,Massachusetts & California,Florida & Montana,Nevada & New Mexico,(NULL),B,,,,0,137529,0,,1,1
SCIENCE & NATURE,NONE,"TEEN,ADULT",30,United States,In 'The Inbetweeners Movie' where do the lads go on holiday?,Ibiza,Crete,Ayia Napa,Magaluf,(NULL),B,,,,0,137537,0,,1,1
