CATEGORY,SUBCATEGORY,AGE,TIMEALLOWED,REGION,QUESTION,ANSWER1,ANSWER2,ANSWER3,ANSWER4,HINT,CORRECTANSWER,IMAGEURL,VIDEOURL,SOUNDURL,FILETYPE,questionMasterId ,status,creditBy,questionActiveStatus,questionState
SPORTS & LEISURE,NONE,"TEEN,ADULT",30,United States,"What NASA space shuttle broke apart 73 seconds into its flight, killing all seven crew members, in 1986?",Endeavour,Discovery,Atlantis,Challenger,(NULL),D,,,,0,149711,0,,1,1
SPORTS & LEISURE,NONE,"TEEN,ADULT",30,United States,Which of these countries joined the European Union on New Year's Day 2007?,Romania,Poland,Slovenia,Austria,(NULL),A,,,,0,149719,0,,1,1
SPORTS & LEISURE,NONE,"TEEN,ADULT",30,United States,Who became the first woman to be appointed as Managing Director of the IMF in 2011?,Sanna Marin,Christine Lagarde,Carla Bruni,Dr. Kristalina Georgieva,(NULL),B,,,,0,149727,0,,1,1
SPORTS & LEISURE,NONE,"TEEN,ADULT",30,United States,In December of what year did the Arab Spring begin?,2009,2011,2010,2008,(NULL),C,,,,0,149735,0,,1,1
SPORTS & LEISURE,NONE,"TEEN,ADULT",30,United States,"In 1946, which country offered to buy Greenland for $100,000,000?",Canada,Switzerland,Russia,USA,(NULL),D,,,,0,149743,0,,1,1
SPORTS & LEISURE,NONE,"TEEN,ADULT",30,United States,Who won the London Mayoral Elections of 2012?,Boris Johnson,Ken Livingstone,Ed Miliband,Sadiq Khan,(NULL),A,,,,0,149751,0,,1,1
SPORTS & LEISURE,NONE,"TEEN,ADULT",30,United States,"Who, in 1991, became the first Briton in space?",Helen Stewart,Helen Sharman,Helen Spencer,Helen Scott,(NULL),B,,,,0,149759,0,,1,1
SPORTS & LEISURE,NONE,"TEEN,ADULT",30,United States,Which two words are inscribed on a Victoria Cross?,For God,For All,For Valour,For Country,(NULL),C,,,,0,149767,0,,1,1
SPORTS & LEISURE,NONE,"TEEN,ADULT",30,United States,"In 1993, what did Barbara Harmer become the first woman to do?",Walk in space,Drive in Formula One,Climb Everest,Fly Concorde,(NULL),D,,,,0,149775,0,,1,1
SPORTS & LEISURE,NONE,"TEEN,ADULT",30,United States,Which of these medical procedures was first attempted in the 1970s?,Face lift,Amputation,Brain surgery,C-section,(NULL),A,,,,0,149783,0,,1,1
SPORTS & LEISURE,NONE,"TEEN,ADULT",30,United States,"September 15th, 1916 saw the first deployment of Big Willie. What was it?",Submarine,Tank,Intercontinental missile,Satellite,(NULL),B,,,,0,149791,0,,1,1
SPORTS & LEISURE,NONE,"TEEN,ADULT",30,United States,"Which tax contributed to the downfall of then UK Prime Minister, Margaret Thatcher?",Value Added Tax,Income Tax,Poll tax,Capital Gains Tax,(NULL),C,,,,0,149799,0,,1,1
SPORTS & LEISURE,NONE,"TEEN,ADULT",30,United States,Which British Lord famously disappeared after the death of his children's nanny in 1974?,Sutch,Bath,Aberdare,Lucan,(NULL),D,,,,0,149807,0,,1,1
SPORTS & LEISURE,NONE,"TEEN,ADULT",30,United States,The Boer War was fought in which country?,South Africa,Namibia,Botswana,Zimbabwe,(NULL),A,,,,0,149815,0,,1,1
SPORTS & LEISURE,NONE,"TEEN,ADULT",30,United States,Eva Peron was First Lady of which country?,Brazil,Argentina,Colombia,Spain,(NULL),B,,,,0,149823,0,,1,1
SPORTS & LEISURE,NONE,"TEEN,ADULT",30,United States,Benazir Bhutto was leader of which country?,India,Myanmar,Pakistan,Bangladesh,(NULL),C,,,,0,149831,0,,1,1
SPORTS & LEISURE,NONE,"TEEN,ADULT",30,United States,Who committed Suicide before the others?,Virginia Woolf,Heinrich Himmler,Alan Turing,Vincent Van Gogh,(NULL),D,,,,0,149839,0,,1,1
SPORTS & LEISURE,NONE,"TEEN,ADULT",30,United States,Who was first to marry Henry VIII from the following?,Catherine of Aragon,Anne Boleyn,Jane Seymour,Anne of Cleves,(NULL),A,,,,0,149847,0,,1,1
SPORTS & LEISURE,NONE,"TEEN,ADULT",30,United States,Which of the following individuals was leader of the Soviet Union before the others?,Stalin,Lenin,Khrushchev,Brezhnev,(NULL),B,,,,0,149855,0,,1,1
SPORTS & LEISURE,NONE,"TEEN,ADULT",30,United States,Which of these happened first?,Taiping Rebellion,Treaty of Tianjin,Great Irish Famine,American Civil War begins,(NULL),C,,,,0,149863,0,,1,1
SPORTS & LEISURE,NONE,"TEEN,ADULT",30,United States,How was Canute's son Harold known?,Harold Hogfoot,Harold Henfoot,Harold Horsefoot,Harold Harefoot,(NULL),D,,,,0,149871,0,,1,1
SPORTS & LEISURE,NONE,"TEEN,ADULT",30,United States,Where was the Queen Mother when she died?,Windsor,Sandringham,Balmoral,Buckingham Palace,(NULL),A,,,,0,149879,0,,1,1
SPORTS & LEISURE,NONE,"TEEN,ADULT",30,United States,Which king came directly before Harold II?,Alfred the Great,Edward the Confessor,William the Conqueror,Ethelred the Unready,(NULL),B,,,,0,149887,0,,1,1
SPORTS & LEISURE,NONE,"TEEN,ADULT",30,United States,Which of these was the name of 19 different kings of France?,Leroy,Lennox,Louis,Laurent,(NULL),C,,,,0,149895,0,,1,1
SPORTS & LEISURE,NONE,"TEEN,ADULT",30,United States,"The worst power outage in world history, affecting 620 million people, occurred where in 2012?",China,Russia,Brazil,India,(NULL),D,,,,0,149903,0,,1,1
SPORTS & LEISURE,NONE,"TEEN,ADULT",30,United States,What was the preferred missile of the Saddam Hussein regime during the first Gulf war?,Scud,Sidewinder,Hellfire,ICBM,(NULL),A,,,,0,149911,0,,1,1
SPORTS & LEISURE,NONE,"TEEN,ADULT",30,United States,Which former managing director of the IMF resigned from his post in 2011?,Nicolas Sarkozy,Dominique Strauss-Kahn,Jean Marie Le Pen,Romano Prodi,(NULL),B,,,,0,149919,0,,1,1
SPORTS & LEISURE,NONE,"TEEN,ADULT",30,United States,U-boat' was the code name for a type of what?,Japanese frigate,US destroyer,German submarine,British submarine,(NULL),C,,,,0,149927,0,,1,1
SPORTS & LEISURE,NONE,"TEEN,ADULT",30,United States,Which Japanese city was the atomic bomb first dropped on?,Nagasaki,Tokyo,Kyoto,Hiroshima,(NULL),D,,,,0,149935,0,,1,1
SPORTS & LEISURE,NONE,"TEEN,ADULT",30,United States,"On the day Winston Churchill became Prime Minister, Britain invaded which country?",Iceland,Norway,Germany,Finland,(NULL),A,,,,0,149943,0,,1,1
SPORTS & LEISURE,NONE,"TEEN,ADULT",30,United States,In which country was the formal surrender of all German forces accepted by the Allies?,Germany,France,Austria,Belgium,(NULL),B,,,,0,149951,0,,1,1
SPORTS & LEISURE,NONE,"TEEN,ADULT",30,United States,Which US state did President Jefferson buy from the French in 1803?,Nevada,Florida,Louisiana,Maryland,(NULL),C,,,,0,149959,0,,1,1
SPORTS & LEISURE,NONE,"TEEN,ADULT",30,United States,How long did the 100 Years War actually last for?,100 years,99 years,101 years,116 years,(NULL),D,,,,0,149967,0,,1,1
SPORTS & LEISURE,NONE,"TEEN,ADULT",30,United States,Alberto Fernandez was elected President of which country in October 2019?,Argentina,Chile,Brazil,Mexico,(NULL),A,,,,0,149975,0,,1,1
SPORTS & LEISURE,NONE,"TEEN,ADULT",30,United States,"In 1980, the SAS ended a siege at the London embassy of which country?",Soviet Union,Iran,China,Pakistan,(NULL),B,,,,0,149983,0,,1,1
SPORTS & LEISURE,NONE,"TEEN,ADULT",30,United States,"In December 2019, President Pervez Musharraf, of which country, was sentenced for treason?",Afghanistan,Bangladesh,Pakistan,India,(NULL),C,,,,0,149991,0,,1,1
SPORTS & LEISURE,NONE,"TEEN,ADULT",30,United States,Which position does Rishi Sunak hold in Boris Johnson's cabinet?,Foreign Secretary,Home Secretary,Health Secretary,Chancellor,(NULL),D,,,,0,149999,0,,1,1
SPORTS & LEISURE,NONE,"TEEN,ADULT",30,United States,In which year did the Queen celebrate her 80th birthday?,2006,2000,2002,2004,(NULL),A,,,,0,150007,0,,1,1
SPORTS & LEISURE,NONE,"TEEN,ADULT",30,United States,What relation is Zara Phillips to the Queen?,Niece,Granddaughter,Daughter,Cousin,(NULL),B,,,,0,150015,0,,1,1
SPORTS & LEISURE,NONE,"TEEN,ADULT",30,United States,How did Russian cosmonaut Yuri Gagarin die?,Naturally,He drowned,In a plane crash,He was shot,(NULL),C,,,,0,150023,0,,1,1
SPORTS & LEISURE,NONE,"TEEN,ADULT",30,United States,What was Gandhi's profession before politics?,Doctor,Architect,Teacher,Lawyer,(NULL),D,,,,0,150031,0,,1,1
SPORTS & LEISURE,NONE,"TEEN,ADULT",30,United States,Who was Tsar Nicholas II's youngest daughter?,Anastasia,Arianna,Alexandra,Alexia,(NULL),A,,,,0,150039,0,,1,1
SPORTS & LEISURE,NONE,"TEEN,ADULT",30,United States,What was the name of Donald Trump's first wife?,Melania,Ivana,Stormy,Ivanka,(NULL),B,,,,0,150047,0,,1,1
SPORTS & LEISURE,NONE,"TEEN,ADULT",30,United States,Whose last words were "I shall hear in heaven"?,Mendelssohn,Mozart,Beethoven,Schubert,(NULL),C,,,,0,150055,0,,1,1
SPORTS & LEISURE,NONE,"TEEN,ADULT",30,United States,"Which scientist and Outsmarted miniature proposed the Special Theory of Relativity, at the start of the 20th century?",Marie Curie,George Washington Carver,Leonardo da Vinci,Albert Einstein,(NULL),D,,,,0,150063,0,,1,1
SPORTS & LEISURE,NONE,"TEEN,ADULT",30,United States,Which World War II leader killed his dog Blondi with cyanide shortly before his own death?,Hitler,Hirohito,Stalin,Mussolini,(NULL),A,,,,0,150071,0,,1,1
SPORTS & LEISURE,NONE,"TEEN,ADULT",30,United States,Which White House intern had an affair with President Clinton?,Santa Monica,Monica Lewinsky,Monica Rose,Monica Waterhouse,(NULL),B,,,,0,150079,0,,1,1
SPORTS & LEISURE,NONE,"TEEN,ADULT",30,United States,Who famously said "Too many of our imports are from abroad"?,Ronald Regan,Jimmy Carter,George W. Bush,Gerald Ford,(NULL),C,,,,0,150087,0,,1,1
SPORTS & LEISURE,NONE,"TEEN,ADULT",30,United States,Marcus Garvey is considered a prophet by which religious group?,Orthodox Jews,Pentecostal Christians,Buddhists,Rastafarians,(NULL),D,,,,0,150095,0,,1,1
SPORTS & LEISURE,NONE,"TEEN,ADULT",30,United States,What is Winston S. Churchill's middle name?,Spencer,Sidney,Stanley,Shane,(NULL),A,,,,0,150103,0,,1,1
SPORTS & LEISURE,NONE,"TEEN,ADULT",30,United States,"What did Saddam Hussein ban in Iraq, in 1977?",Issuing of passports,Use of surnames,Watching television,Make-up,(NULL),B,,,,0,150111,0,,1,1
SPORTS & LEISURE,NONE,"TEEN,ADULT",30,United States,What colour were Mussolini Fascist's shirts?,Red,Yellow,Black,Green,(NULL),C,,,,0,150119,0,,1,1
SPORTS & LEISURE,NONE,"TEEN,ADULT",30,United States,The Shah was the former ruler of which Islamic country?,Saudi Arabia,Pakistan,Oman,Iran,(NULL),D,,,,0,150127,0,,1,1
SPORTS & LEISURE,NONE,"TEEN,ADULT",30,United States,Who declared martial law in the Philippines in 1972?,Marcos,Franco,Aquino,Duvalier,(NULL),A,,,,0,150135,0,,1,1
SPORTS & LEISURE,NONE,"TEEN,ADULT",30,United States,Ptolemy ruled which ancient empire from 323BC to 283BC?,Roman,Egyptian,Persian,Greek,(NULL),B,,,,0,150143,0,,1,1
SPORTS & LEISURE,NONE,"TEEN,ADULT",30,United States,Which of these men is a former Prime Minister of Canada?,Michel Platini,Maurice Chevalier,Pierre Trudeau,Gustave Flaubert,(NULL),C,,,,0,150151,0,,1,1
SPORTS & LEISURE,NONE,"TEEN,ADULT",30,United States,Gaddafi became leader of Libya at the end of which decade?,70s,90s,80s,60s,(NULL),D,,,,0,150159,0,,1,1
SPORTS & LEISURE,NONE,"TEEN,ADULT",30,United States,"In 1992, who did Bill Clinton beat to become US President?",George H. W. Bush,Ronald Reagan,Dan Quayle,George W. Bush,(NULL),A,,,,0,150167,0,,1,1
SPORTS & LEISURE,NONE,"TEEN,ADULT",30,United States,General Pinochet took control of which country in the '70s?,Cuba,Chile,Romania,Argentina,(NULL),B,,,,0,150175,0,,1,1
SPORTS & LEISURE,NONE,"TEEN,ADULT",30,United States,Which of these leaders was best man at Idi Amin's fifth wedding?,Fidel Castro,Colonel Gaddafi,Yasser Arafat,Richard Nixon,(NULL),C,,,,0,150183,0,,1,1
SPORTS & LEISURE,NONE,"TEEN,ADULT",30,United States,"In 2000, who became President of Syria?",Maher al-Assad,Hassan Nasrallah,Wael Nader al-Halqi,Bashar Al-Assad,(NULL),D,,,,0,150191,0,,1,1
SPORTS & LEISURE,NONE,"TEEN,ADULT",30,United States,Which North Korean leader died in 2011?,Kim Jong-Il,Kim Jong-un,Kim Il-sung,Kim Jong-Nam,(NULL),A,,,,0,150199,0,,1,1
SPORTS & LEISURE,NONE,"TEEN,ADULT",30,United States,Which popular newspaper was founded in 1843?,The Sun,News of the World,Daily Star,Daily Mirror,(NULL),B,,,,0,150207,0,,1,1
SPORTS & LEISURE,NONE,"TEEN,ADULT",30,United States,Which Conservative Party leader did not become Prime Minister?,David Cameron,Anthony Eden,William Hague,Harold Macmillan,(NULL),C,,,,0,150215,0,,1,1
SPORTS & LEISURE,NONE,"TEEN,ADULT",30,United States,The "Rivers of Blood" speech was delivered by which politician?,Tony Blair,Tony Benn,Gordon Brown,Enoch Powell,(NULL),D,,,,0,150223,0,,1,1
SPORTS & LEISURE,NONE,"TEEN,ADULT",30,United States,Barack Obama defeated who in the 2012 U.S. presidential election?,Mitt Romney,Paul Ryan,Jeb Bush,John McCain,(NULL),A,,,,0,150231,0,,1,1
SPORTS & LEISURE,NONE,"TEEN,ADULT",30,United States,"Vladimir Putin was succeeded by whom as Russian President, in 2008?",Boris Yeltsin,Dmitry Medvedev,Sergey Lavrov,Mikhail Gorbachev,(NULL),B,,,,0,150239,0,,1,1
SPORTS & LEISURE,NONE,"TEEN,ADULT",30,United States,"In 2011, which nation became the newest member of the United Nations?",North Senegal,East Kenya,South Sudan,West Nigeria,(NULL),C,,,,0,150247,0,,1,1
SPORTS & LEISURE,NONE,"TEEN,ADULT",30,United States,Which of these men was a political theorist?,Edmund Mug,Edmund Nogood,Edmund Fool,Edmund Burke,(NULL),D,,,,0,150255,0,,1,1
SPORTS & LEISURE,NONE,"TEEN,ADULT",30,United States,"""In politics nothing is contemptible."" was famously said by whom?",Benjamin Disraeli,Tony Blair,Jimmy Carter,Barry Goldwater,(NULL),A,,,,0,150263,0,,1,1
SPORTS & LEISURE,NONE,"TEEN,ADULT",30,United States,"Hindu pilgrims visit the holy cities, Varanasi and Allahabad along what river's banks?",Indus,Ganges,Tigris,Euphrates,(NULL),B,,,,0,150271,0,,1,1
SPORTS & LEISURE,NONE,"TEEN,ADULT",30,United States,What religion represents its Eightfold Path with a Dharma wheel containing eight spokes?,Confucianism,Hinduism,Buddhism,Islam,(NULL),C,,,,0,150279,0,,1,1
SPORTS & LEISURE,NONE,"TEEN,ADULT",30,United States,"What was former US Secretary of State, Hillary Clinton's maiden name?",Riley,Roachford,Ringwald,Rodham,(NULL),D,,,,0,150287,0,,1,1
SPORTS & LEISURE,NONE,"TEEN,ADULT",30,United States,Which 20th century politician stood unsuccessfully for Parliament five times?,Winston Churchill,Edward Heath,Harold Wilson,Margaret Thatcher,(NULL),A,,,,0,150295,0,,1,1
SPORTS & LEISURE,NONE,"TEEN,ADULT",30,United States,Which American actor was President of the National Rifle Association?,Burt Reynolds,Charlton Heston,Arnold Schwarzenegger,Charles Bronson,(NULL),B,,,,0,150303,0,,1,1
SPORTS & LEISURE,NONE,"TEEN,ADULT",30,United States,Which animal symbolizes the US Democratic Party?,Elephant,Moose,Donkey,Eagle,(NULL),C,,,,0,150311,0,,1,1
SPORTS & LEISURE,NONE,"TEEN,ADULT",30,United States,Which library is the world's largest?,Bibliotheca Alexandrina,Bodleian Library,New York Public Library,Library of Congress,(NULL),D,,,,0,150319,0,,1,1
SPORTS & LEISURE,NONE,"TEEN,ADULT",30,United States,"In the 1990s, whose political career was destabilised following his affair with Antonia da Sancha?",David Mellor,John Major,Michael Portillo,Ken Livingstone,(NULL),A,,,,0,150327,0,,1,1
SPORTS & LEISURE,NONE,"TEEN,ADULT",30,United States,"According to Alastair Campbell's diaries, which Labour politician once threw a punch at him?",John Prescott,Peter Mandelson,Tony Blair,Clare Short,(NULL),B,,,,0,150335,0,,1,1
SPORTS & LEISURE,NONE,"TEEN,ADULT",30,United States,"In the 80s, which 'bug' caused Edwina Currie's political career to be put on hold?",German measles,Botulism,Salmonella,Campylobacter,(NULL),C,,,,0,150343,0,,1,1
SPORTS & LEISURE,NONE,"TEEN,ADULT",30,United States,Which British Prime Minister resigned over the Suez Crisis?,Harold Macmillan,Anthony Eden,Clement Atlee,Neville Chamberlain,(NULL),B,,,,0,150355,0,,1,1
SPORTS & LEISURE,NONE,"TEEN,ADULT",30,United States,Which country has the most MEPs?,France,Switzerland,Germany,Italy,(NULL),C,,,,0,150363,0,,1,1
SPORTS & LEISURE,NONE,"TEEN,ADULT",30,United States,Which of these actors became Governor of California in 2003?,Clint Eastwood,Leonardo DiCaprio,Jack Nicholson,Arnold Schwarzenegger,(NULL),D,,,,0,150371,0,,1,1
SPORTS & LEISURE,NONE,"TEEN,ADULT",30,United States,"Which of these names was given to former Prime Minister, Margaret Thatcher in the 1970s?",Milk Snatcher,Egg Hatcher,Door Latcher,Cheese Catcher,(NULL),A,,,,0,150379,0,,1,1
SPORTS & LEISURE,NONE,"TEEN,ADULT",30,United States,Who was a British Prime Minister during World War I?,Disraeli,Asquith,Pitt the Younger,Gladstone,(NULL),B,,,,0,150387,0,,1,1
SPORTS & LEISURE,NONE,"TEEN,ADULT",30,United States,"Which political party did former MP, Tony Benn represent?",Social Democratic Party,Liberal Democrats,Labour Party,Conservative Party,(NULL),C,,,,0,150395,0,,1,1
SPORTS & LEISURE,NONE,"TEEN,ADULT",30,United States,Which political party did Sir Oswald Moseley lead in the 1930s?,Common Wealth Party,National Liberal Party,English National Party,Independent Labour Party,(NULL),D,,,,0,150403,0,,1,1
SPORTS & LEISURE,NONE,"TEEN,ADULT",30,United States,Which politician's middle name is Jefferson?,William Hague,Margaret Beckett,David Cameron,Charles Kennedy,(NULL),A,,,,0,150411,0,,1,1
SPORTS & LEISURE,NONE,"TEEN,ADULT",30,United States,Who first developed the ideology of fascism?,Hitler,Mussolini,Trotsky,Stalin,(NULL),B,,,,0,150419,0,,1,1
SPORTS & LEISURE,NONE,"TEEN,ADULT",30,United States,"Who was Britain's last Labour Prime Minister, prior to Tony Blair?",Edward Heath,Harold Wilson,James Callaghan,Clement Attlee,(NULL),C,,,,0,150427,0,,1,1
SPORTS & LEISURE,NONE,"TEEN,ADULT",30,United States,Who was 'The Iron Chancellor'?,Margaret Thatcher,Gordon Brown,Alistair Darling,Otto Von Bismarck,(NULL),D,,,,0,150435,0,,1,1
SPORTS & LEISURE,NONE,"TEEN,ADULT",30,United States,Who was the leader of the Liberal Democrats before Charles Kennedy?,Paddy Ashdown,David Steel,David Owen,Simon Hughes,(NULL),A,,,,0,150443,0,,1,1
SPORTS & LEISURE,NONE,"TEEN,ADULT",30,United States,Which monarch ruled for only 9 days?,Richard II,Lady Jane Grey,Henry VIII,Elizabeth II,(NULL),B,,,,0,150451,0,,1,1
SPORTS & LEISURE,NONE,"TEEN,ADULT",30,United States,Which of these people died a week after Princess Diana?,Mahatma Gandhi,Nelson Mandela,Mother Teresa,Pope John Paul II,(NULL),C,,,,0,150905,0,,1,1
SPORTS & LEISURE,NONE,"TEEN,ADULT",30,United States,What was the name of Princess Diana's butler?,Charles Spencer,Oliver Hirschbiegel,Patrick Jephson,Paul Burrell,(NULL),D,,,,0,150913,0,,1,1
SPORTS & LEISURE,NONE,"TEEN,ADULT",30,United States,Which of these actresses was a cousin of Princess Diana?,Marilyn Monroe,Audrey Hepburn,Elizabeth Taylor,Grace Kelly,(NULL),B,,,,0,150923,0,,1,1
SPORTS & LEISURE,NONE,"TEEN,ADULT",30,United States,Who is second in the line of succession to the US presidency after the Vice President?,Foreign Secretary,Secretary of State,Speaker of the House,Secretary of the Treasury,(NULL),C,,,,0,150931,0,,1,1
SPORTS & LEISURE,NONE,"TEEN,ADULT",30,United States,Who was the only US president to have earned a PhD degree?,Barack Obama,Bill Clinton,Herbert Hoover,Woodrow Wilson,(NULL),D,,,,0,150939,0,,1,1
SPORTS & LEISURE,NONE,"TEEN,ADULT",30,United States,"Actor and politician, Ronald Reagan, was once governor of which US state?",California,Illinois,New York,Texas,(NULL),A,,,,0,150947,0,,1,1
SPORTS & LEISURE,NONE,"TEEN,ADULT",30,United States,Which official traditionally administers the oath of office to the US President on Inauguration Day?,Attorney General,Chief Justice,Outgoing President,Secretary of State,(NULL),B,,,,0,150955,0,,1,1
SPORTS & LEISURE,NONE,"TEEN,ADULT",30,United States,"What is the name of the presidential retreat, located in Maryland?",Camp Daniel,Camp Dawes,Camp David,Camp Darwin,(NULL),C,,,,0,150963,0,,1,1
SPORTS & LEISURE,NONE,"TEEN,ADULT",30,United States,Who was the only US President to resign from office?,James Buchanan,Andrew Johnson,Gerald Ford,Richard Nixon,(NULL),D,,,,0,150971,0,,1,1
SPORTS & LEISURE,NONE,"TEEN,ADULT",30,United States,"Before being elected president, Bill Clinton was governor of which US state?",Arkansas,Alabama,Tennessee,Oklahoma,(NULL),A,,,,0,150979,0,,1,1
SPORTS & LEISURE,NONE,"TEEN,ADULT",30,United States,Presidential inaugurations are usually carried out on the steps of which building?,The White House,The Capitol,The Pentagon,The Treasury,(NULL),B,,,,0,150987,0,,1,1
SPORTS & LEISURE,NONE,"TEEN,ADULT",30,United States,Which former US President has twin daughters called Jenna and Barbara?,Jimmy Carter,George H. W. Bush,George W. Bush,Bill Clinton,(NULL),C,,,,0,150995,0,,1,1
SPORTS & LEISURE,NONE,"TEEN,ADULT",30,United States,"Since 1933, presidential inaugurations have traditionally taken place on which date?",January 10th,January 15th,January 30th,January 20th,(NULL),D,,,,0,151003,0,,1,1
SPORTS & LEISURE,NONE,"TEEN,ADULT",30,United States,What is the minimum age requirement for a candidate to become president of the USA?,35,40,30,25,(NULL),A,,,,0,151011,0,,1,1
"BRANDS, BUSINESS & TECHNOLOGY",NONE,"TEEN,ADULT",30,United States,"In architecture, how is a projecting part at the top of a building known?",Gargoyle,Cornice,Tracery,Mullion,(NULL),B,,,,0,151019,0,,1,1
"BRANDS, BUSINESS & TECHNOLOGY",NONE,"TEEN,ADULT",30,United States,In which city would you find the Cenotaph?,Manchester,Birmingham,London,Leeds,(NULL),C,,,,0,151027,0,,1,1
"BRANDS, BUSINESS & TECHNOLOGY",NONE,"TEEN,ADULT",30,United States,Which of these English cathedrals is the tallest?,Derby Cathedral,Canterbury Cathedral,Norwich Cathedral,St. Paul's London,(NULL),D,,,,0,151035,0,,1,1
"BRANDS, BUSINESS & TECHNOLOGY",NONE,"TEEN,ADULT",30,United States,"Now famous for another reason, where was the first lighthouse situated on America's west coast?",Alcatraz,Cannery Row,Pebble Beach,Venice Beach,(NULL),A,,,,0,151043,0,,1,1
"BRANDS, BUSINESS & TECHNOLOGY",NONE,"TEEN,ADULT",30,United States,What is an estate car called in the US?,Convertible,Station wagon,SUV,Pick-up,(NULL),B,,,,0,151051,0,,1,1
"BRANDS, BUSINESS & TECHNOLOGY",NONE,"TEEN,ADULT",30,United States,Which car model from Chevrolet shares its name with a Californian beach?,Silverado,Santa Monica,Malibu,Impala,(NULL),C,,,,0,151059,0,,1,1
"BRANDS, BUSINESS & TECHNOLOGY",NONE,"TEEN,ADULT",30,United States,Which car brand was the first to fit seatbelts as standard?,Volvo,Skoda,Ford,Saab,(NULL),D,,,,0,151067,0,,1,1
"BRANDS, BUSINESS & TECHNOLOGY",NONE,"TEEN,ADULT",30,United States,Dacia is a car manufacturer from which country?,Romania,Bulgaria,Russia,Ukraine,(NULL),A,,,,0,151075,0,,1,1
"BRANDS, BUSINESS & TECHNOLOGY",NONE,"TEEN,ADULT",30,United States,Koenigsegg cars are produced where?,Norway,Sweden,Denmark,Iceland,(NULL),B,,,,0,151083,0,,1,1
"BRANDS, BUSINESS & TECHNOLOGY",NONE,"TEEN,ADULT",30,United States,"Lifan, Geely and BYD are car brands from which country?",India,Nigeria,China,Brazil,(NULL),C,,,,0,151091,0,,1,1
"BRANDS, BUSINESS & TECHNOLOGY",NONE,"TEEN,ADULT",30,United States,Opel is the German division of which US car manufacturer?,Toyota,Ford Motor Company,Daimler,General Motors,(NULL),D,,,,0,151099,0,,1,1
"BRANDS, BUSINESS & TECHNOLOGY",NONE,"TEEN,ADULT",30,United States,"Popular at Christmas, what is 'Gluhwein'?",Mulled wine,Chocolate log,Marzipan,Gingerbread,(NULL),A,,,,0,151107,0,,1,1
"BRANDS, BUSINESS & TECHNOLOGY",NONE,"TEEN,ADULT",30,United States,Easter is the celebration of what?,Crucifixion of Christ,Resurrection of Christ,Immaculate conception,Birth of Jesus,(NULL),B,,,,0,151115,0,,1,1
"BRANDS, BUSINESS & TECHNOLOGY",NONE,"TEEN,ADULT",30,United States,The Easter egg is a symbol of what?,Fertility,Mourning,Rebirth,Hunger,(NULL),C,,,,0,151123,0,,1,1
"BRANDS, BUSINESS & TECHNOLOGY",NONE,"TEEN,ADULT",30,United States,Which artist did Valerie Solanas attempt to kill in 1968?,Pablo Picasso,Francis Bacon,Roy Lichtenstein,Andy Warhol,(NULL),D,,,,0,151131,0,,1,1
"BRANDS, BUSINESS & TECHNOLOGY",NONE,"TEEN,ADULT",30,United States,"In the UK, what percentage of crimes are committed by men?",80%,60%,50%,25%,(NULL),A,,,,0,151139,0,,1,1
"BRANDS, BUSINESS & TECHNOLOGY",NONE,"TEEN,ADULT",30,United States,"Now generally known as 'Jack the Ripper', how was the mass murderer known at the time of his crimes?",Demon Barber of Fleet St,Whitechapel Murderer,Artful Dodger,Backstreet Butcher,(NULL),B,,,,0,151147,0,,1,1
"BRANDS, BUSINESS & TECHNOLOGY",NONE,"TEEN,ADULT",30,United States,"Art museum, MOMA, can be found in which city?",London,Paris,New York,Bilbao,(NULL),C,,,,0,151155,0,,1,1
"BRANDS, BUSINESS & TECHNOLOGY",NONE,"TEEN,ADULT",30,United States,"Where was the architect, Sir Christopher Wren born?",Staffordshire,Cumbria,Cornwall,Wiltshire,(NULL),D,,,,0,151163,0,,1,1
"BRANDS, BUSINESS & TECHNOLOGY",NONE,"TEEN,ADULT",30,United States,Which portrait is famed for its 'enigmatic smile'?,The Mona Lisa,The Laughing Cavalier,Rosie the Riveter,Madame X,(NULL),A,,,,0,151171,0,,1,1
"BRANDS, BUSINESS & TECHNOLOGY",NONE,"TEEN,ADULT",30,United States,Who is the American artist best known for 'Whaam!'?,Fred Wagner,Roy Lichtenstein,Jasper Johns,James Rosenquist,(NULL),B,,,,0,151179,0,,1,1
"BRANDS, BUSINESS & TECHNOLOGY",NONE,"TEEN,ADULT",30,United States,What was the first name of the composer Mendelssohn?,Sergei,Dmitri,Felix,Andre,(NULL),C,,,,0,151187,0,,1,1
"BRANDS, BUSINESS & TECHNOLOGY",NONE,"TEEN,ADULT",30,United States,"Name former SAS member, Andy McNab's 1993 bestselling Gulf War account?",Enemy at the Gates,Three Kings,The Kingdom,Bravo Two Zero,(NULL),D,,,,0,151195,0,,1,1
"BRANDS, BUSINESS & TECHNOLOGY",NONE,"TEEN,ADULT",30,United States,Which of these books was written by William Golding?,Lord of the Flies,The Great Gatsby,1984,The Thirty-Nine Steps,(NULL),A,,,,0,151203,0,,1,1
"BRANDS, BUSINESS & TECHNOLOGY",NONE,"TEEN,ADULT",30,United States,How?many?paintings?did?Van?Gogh?sell?in?his?lifetime?,Two,One,Six,Eleven,(NULL),B,,,,0,151211,0,,1,1
"BRANDS, BUSINESS & TECHNOLOGY",NONE,"TEEN,ADULT",30,United States,Which 'B' is the birthplace of artist Damien Hirst?,Belfast,Birmingham,Bristol,Bradford,(NULL),C,,,,0,151219,0,,1,1
"BRANDS, BUSINESS & TECHNOLOGY",NONE,"TEEN,ADULT",30,United States,"In literature, what is the opposite of a protagonist?",Extortionist,Detagonist,Anthropologist,Antagonist,(NULL),D,,,,0,151227,0,,1,1
