CATEGORY,SUBCATEGORY,AGE,TIMEALLOWED,REGION,QUESTION,ANSWER1,ANSWER2,ANSWER3,ANSWER4,HINT,CORRECTANSWER,IMAGEURL,VIDEOURL,SOUNDURL,FILETYPE,questionMasterId ,status,creditBy,questionActiveStatus,questionState
SPORTING QUESTION,NONE,"TEEN,ADULT",30,United States,"In darts, what is the second highest checkout score?",167,163,169,180,(NULL),A,storage/questions/images/Sport 182.jpg,,,1,128665,0,,1,1
SPORTING QUESTION,NONE,"TEEN,ADULT",30,United States,"In professional darts tournaments, what score do the players start on?",301,501,180,540,(NULL),B,storage/questions/images/Sport 183.jpg,,,1,128673,0,,1,1
SPORTING QUESTION,NONE,"TEEN,ADULT",30,United States,"In which English venue were the World Professional Darts Championship (PDCs) held, between 1994 to 2007?","Alexandra Palace, London","Crucible Theatre, Sheffield","Circus Tavern, Purfleet","Utilita Arena, Newcastle",(NULL),C,storage/questions/images/Sport 184.jpg,,,1,128681,0,,1,1
SPORTING QUESTION,NONE,"TEEN,ADULT",30,United States,In which sport might you get 'three in a bed'?,Archery,Golf,Tennis,Darts,(NULL),D,,,,0,128689,0,,1,1
SPORTING QUESTION,NONE,"TEEN,ADULT",30,United States,"On a darts board, what number is directly opposite number 20?",3,1,10,5,(NULL),A,storage/questions/images/Sport 186.jpg,,,1,128697,0,,1,1
SPORTING QUESTION,NONE,"TEEN,ADULT",30,United States,Who is this legendary darts player?,Michael van Gerwen,Raymond van Barneveld,Dennis Priestley,Simon Whitlock,(NULL),B,storage/questions/images/Sport 187.jpg,,,1,128705,0,,1,1
SPORTING QUESTION,NONE,"TEEN,ADULT",30,United States,What are these Ferrari Formula 1 fans known as?,Sostenitori,Fugazis,Tifosi,Fanablas,(NULL),C,storage/questions/images/Sport 188.jpg,,,1,128713,0,,1,1
SPORTING QUESTION,NONE,"TEEN,ADULT",30,United States,In which sport would you expect to see certain fans describing themselves as the 'The Barney Army'?,Snooker,Cricket,Curling,Darts,(NULL),D,,,,0,128721,0,,1,1
SPORTING QUESTION,NONE,"TEEN,ADULT",30,United States,Which darts player was nicknamed 'The Crafty Cockney'?,Eric Bristow,Jocky Wilson,John Lowe,Phil Taylor,,A,storage/questions/images/Sport 190.jpg,,,1,128729,0,,1,1
SPORTING QUESTION,NONE,JUNIOR,30,United States,How much is the bullseye worth in darts?,20,50,25,60,(NULL),B,,storage/questions/videos/vW8lX1634744127867.m4v,,3,128737,0,,1,1
SPORTING QUESTION,NONE,"JUNIOR,TEEN",30,United States,The oche features in which sport?,Football,Rugby,Darts,Snooker,(NULL),C,storage/questions/images/Sport 192.jpg,,,1,128741,0,,1,1
SPORTING QUESTION,NONE,ADULT,30,United States,Which iconic darts player is shown here with his son Richie?,Gary Anderson,Martin Adams,Jocky Wilson,Bobby George,(NULL),D,storage/questions/images/Sport 193.jpg,,,1,128749,0,,1,1
SPORTING QUESTION,NONE,ADULT,30,United States,"With the most World Championship titles in the history of the sport, what is this player's nickname?",The Power,Jackpot,The Matador,The Martial Dartist,(NULL),A,storage/questions/images/Sport 194.jpg,,,1,128753,0,,1,1
SPORTING QUESTION,NONE,ADULT,30,United States,What is the Australian darts legend Simon Whitlock called on tour?,The Viking,The Wizard,The Dutch Destroyer,Barney,(NULL),B,storage/questions/images/Sport 195.jpg,,,1,128757,0,,1,1
SPORTING QUESTION,NONE,"TEEN,ADULT",30,United States,Dave Mirra (right) is a professional in which extreme sport?,Rallying,Skateboarding,BMX,Motocross,(NULL),C,storage/questions/images/Sport 196.jpg,,,1,128761,0,,1,1
SPORTING QUESTION,NONE,"TEEN,ADULT",30,United States,"Who is the American stunt performer and entertainer, photographed here jumping 19 cars in California?",Sir Eddie Kidd,Eddie the Eagle,Dwayne Johnson,Evel Knievel,(NULL),D,storage/questions/images/52cGL1634738132334.jpg,,,1,128769,0,,1,1
SPORTING QUESTION,NONE,"TEEN,ADULT",30,United States,Surfing is credited with being the first board sport. Which culture does it come from?,Polynesian,Native American,Aboriginal,Maori,,A,storage/questions/images/Sport 198.jpg,,,1,128777,0,,1,1
SPORTING QUESTION,NONE,"TEEN,ADULT",30,United States,Which beach is not considered one of the world's top surfing destinations?,Bondi Beach,Black's Beach,Huntington Beach,Playa Grande,(NULL),B,storage/questions/images/Sport 199.jpg,,,1,128785,0,,1,1
SPORTING QUESTION,NONE,"TEEN,ADULT",30,United States,Which of these skateboarders fronts a series of video games?,Rodney Mullen,Rob Dyrdek,Tony Hawk,Shaun White,(NULL),C,storage/questions/images/Sport 200.jpg,,,1,128793,0,,1,1
SPORTING QUESTION,NONE,"TEEN,ADULT",30,United States,Which of these techniques is NOT related to surfing?,Gnarly,Hang Ten,Barrel,Telemark,(NULL),D,storage/questions/images/Sport 201.jpg,,,1,128801,0,,1,1
SPORTING QUESTION,NONE,JUNIOR,30,United States,"What sport was created from a combination of water skiing, snowboarding and surfing?",Wakeboarding,Surfboarding,Skiboarding,Flightboarding,(NULL),A,storage/questions/images/Sport 202.jpg,,,1,128809,0,,1,1
SPORTING QUESTION,NONE,"TEEN,ADULT",30,United States,What's the middle name of this 6-time Ballon d'Or winner?,Marcelo,Andres,Richie,Sebastian,(NULL),B,storage/questions/images/Sport 203.jpg,,,1,128813,0,,1,1
SPORTING QUESTION,NONE,JUNIOR,30,United States,Which ex-Barcelona football player is shown here?,Christiano Ronaldo,Andres Iniesta,Lionel Messi,Xavi,(NULL),C,storage/questions/images/Sport 204.jpg,,,1,128821,0,,1,1
SPORTING QUESTION,NONE,"TEEN,ADULT",30,United States,Who's the only English player to have won the Ballon d'Or twice?,Bobby Charlton,Michael Owen,Alan Shearer,Kevin Keegan,(NULL),D,storage/questions/images/Sport 205.jpg,,,1,128825,0,,1,1
SPORTING QUESTION,NONE,JUNIOR,30,United States,"Who is the only player to have won the Ballon d'Or, during the era of Ronaldo & Messi?",Luka Modric,Mohammed Salah,Franck Ribery,Kevin De Bruyne,(NULL),A,storage/questions/images/Sport 206.jpg,,,1,128833,0,,1,1
SPORTING QUESTION,NONE,"JUNIOR,TEEN",30,United States,Which Premiership team is not in the 2021/2022 Champions League?,Chelsea,Tottenham,Manchester City,Manchester United,(NULL),B,storage/questions/images/Sport 207.jpg,,,1,128837,0,,1,1
SPORTING QUESTION,NONE,"TEEN,ADULT",30,United States,"Which former Premier League team accumulated the lowest number of points in a Premier League season, with 11 points?",Queens Park Rangers,Leeds United,Derby,Wolverhampton Wanderers,(NULL),C,storage/questions/images/Sport 208.jpg,,,1,128845,0,,1,1
SPORTING QUESTION,NONE,"TEEN,ADULT",30,United States,Which former Premier League team was defunct in 2004?,Bolton Wanderers,Oldham Athletic,Torquay United,Wimbledon,(NULL),D,storage/questions/images/Sport 209.jpg,,,1,128853,0,,1,1
SPORTING QUESTION,NONE,"TEEN,ADULT",30,United States,Which of the following grounds will not host any 2021/2022 Premiership games?,Craven Cottage,Goodison Park,Carrow Road,Vicarage Road,(NULL),A,storage/questions/images/Sport 210.jpg,,,1,128861,0,,1,1
SPORTING QUESTION,NONE,"TEEN,ADULT",30,United States,"Which Premier League team has been relegated the most, 5 times, since 1992?",Crystal Palace,Norwich City,Middlesbrough,Sunderland,(NULL),B,storage/questions/images/Sport 211.jpg,,,1,128869,0,,1,1
SPORTING QUESTION,NONE,JUNIOR,30,United States,This Liverpool sensation plays international football for which country?,Algeria,Turkey,Egypt,Spain,(NULL),C,storage/questions/images/Sport 212.jpg,,,1,128877,0,,1,1
SPORTING QUESTION,NONE,JUNIOR,30,United States,This manager took over at which English club in 2016?,Liverpool,Manchester United,Chelsea,Manchester City,(NULL),D,storage/questions/images/Sport 213.jpg,,,1,128881,0,,1,1
SPORTING QUESTION,NONE,"TEEN,ADULT",30,United States,"All but which of the following are Major League Soccer teams, in the United States?",Atlanta Thrashers,LA Galaxy,DC United,San Jose Earthquakes,(NULL),A,storage/questions/images/Sport 214.jpg,,,1,128885,0,,1,1
SPORTING QUESTION,NONE,"TEEN,ADULT",30,United States,Which team won the 2020 Major League Soccer season?,LA Galaxy,Columbus Crew,Toronto FC,Colorado Rapids,(NULL),B,storage/questions/images/Sport 215.jpg,,,1,128893,0,,1,1
SPORTING QUESTION,NONE,"TEEN,ADULT",30,United States,"Who is the top Major League Soccer scorer of all time, with over 160 goals?",Landon Donovan,Carlos Fierro,Chris Wondolowski,Bradley Wright-Phillips,(NULL),C,storage/questions/images/Sport 216.jpg,,,1,128901,0,,1,1
SPORTING QUESTION,NONE,JUNIOR,30,United States,"In the United States, what is played in the MLS, sporting league?",Baseball,Basketball,American Football,Football,(NULL),D,storage/questions/images/Sport 217.jpg,,,1,128909,0,,1,1
SPORTING QUESTION,NONE,"TEEN,ADULT",30,United States,In what year were West Bromwich Albion last promoted to the English Premier League?,2020,2019,2021,2018,(NULL),A,storage/questions/images/Sport 218.jpg,,,1,128913,0,,1,1
SPORTING QUESTION,NONE,"TEEN,ADULT",30,United States,Millwall FC play at this stadium. What's their team's nickname?,The Foxes,The Lions,The Red Devils,The Peacocks,,B,storage/questions/images/QnkNJ1634737930060.jpg,,,1,128921,0,,1,1
SPORTING QUESTION,NONE,"TEEN,ADULT",30,United States,"Home to 'The Bluebirds', what's this football ground called?",Stamford Bridge,Coventry Building Society Arena,Cardiff City Stadium,St. Andrew's,(NULL),C,storage/questions/images/Sport 220.jpg,,,1,128929,0,,1,1
SPORTING QUESTION,NONE,"TEEN,ADULT",30,United States,What's this team's home stadium called?,Emirates Stadium,King Power Stadium,The Valley,Etihad Stadium,(NULL),D,storage/questions/images/hUISU1634737755378.jpg,,,1,128937,0,,1,1
SPORTING QUESTION,NONE,"TEEN,ADULT",30,United States,Which two teams are seen playing here in 2008?,Everton & Newcastle,West Bromwich Albion & Chelsea,Fulham and Birmingham City,Watford and Queens Park Rangers,(NULL),A,storage/questions/images/Sport 222.jpg,,,1,128945,0,,1,1
SPORTING QUESTION,NONE,"TEEN,ADULT",30,United States,"Which player left Manchester City for Bayern Munich, in a 40m deal, in 2020?",Serge Gnabry,Leroy Sane,Phil Foden,Jadon Sancho,(NULL),B,storage/questions/images/Sport 223.jpg,,,1,128953,0,,1,1
SPORTING QUESTION,NONE,"TEEN,ADULT",30,United States,"Pictured here (left), who was the women's top scorer in the Women's Super League 2019/2020",Beth England,Pauline Bremer,Vivianne Miedema,Chloe Kelly,(NULL),C,storage/questions/images/Sport 224.jpg,,,1,128961,0,,1,1
SPORTING QUESTION,NONE,"TEEN,ADULT",30,United States,What football club did Nicolas Anelka play for before signing a contract with Chelsea in 2008?,Manchester City,West Bromwich Albion,Shanghai Shenhua,Bolton Wanderers,(NULL),D,storage/questions/images/Sport 225.jpg,,,1,128969,0,,1,1
SPORTING QUESTION,NONE,"TEEN,ADULT",30,United States,"Who has registered the fastest time in a Liverpool shirt, at 21.6mph?",Joe Gomez,Virgil van Dijk,Sadio Mane,Andy Robertson,(NULL),A,storage/questions/images/Sport 226.jpg,,,1,128977,0,,1,1
SPORTING QUESTION,NONE,"TEEN,ADULT",30,United States,Who is this ex Portuguese international player?,Luis Figo,Rui Costa,Jorge Costa,Nuno Gomes,(NULL),B,storage/questions/images/Sport 227.jpg,,,1,128985,0,,1,1
SPORTING QUESTION,NONE,JUNIOR,30,United States,"Which country was this French footballing legend, affectionately known as 'Zizou' born?",Tunisia,Algeria,France,Congo,(NULL),C,storage/questions/images/Sport 228.jpg,,,1,128993,0,,1,1
SPORTING QUESTION,NONE,"JUNIOR,TEEN",30,United States,Who is this Brazilian footballing Legend?,Rivaldo,Ronaldo,Kak,Pele,(NULL),D,storage/questions/images/Sport 229.jpg,,,1,128997,0,,1,1
SPORTING QUESTION,NONE,"JUNIOR,TEEN,ADULT",30,United States,Who is this Hungarian footballing Legend?,Ferenc Puskas,Johan Cruyff,Franz Beckenbauer,Zinedine Zidane,(NULL),A,storage/questions/images/Sport 230.jpg,,,1,129005,0,,1,1
SPORTING QUESTION,NONE,"TEEN,ADULT",30,United States,What is the name of this legendary football manager's spouse?,Loraine,Cathy,Irene,Jessica,(NULL),B,storage/questions/images/Sport 231.jpg,,,1,129017,0,,1,1
SPORTING QUESTION,NONE,"TEEN,ADULT",30,United States,Which country is the former Manchester City striker from?,Brazil,Uruguay,Argentina,Chile,(NULL),C,storage/questions/images/Sport 232.jpg,,,1,129025,0,,1,1
SPORTING QUESTION,NONE,"TEEN,ADULT",30,United States,"Which football team has this accomplished manager, not managed?",Manchester City,Barcelona,Bayern Munich,Juventus,(NULL),D,storage/questions/images/Sport 233.jpg,,,1,129033,0,,1,1
SPORTING QUESTION,NONE,"TEEN,ADULT",30,United States,"During the 2018/2019 Premiership season, who didn't win the Golden Boot?",Jamie Vardy,Pierre-Emerick Aubameyang,Sadio Mane,Mohamed Salah,(NULL),A,storage/questions/images/Sport 234.jpg,,,1,129041,0,,1,1
SPORTING QUESTION,NONE,"TEEN,ADULT",30,United States,Martin O'Neill managed which Premiership team in the 2009/10 season?,Birmingham City,Aston Villa,Everton,Sunderland,(NULL),B,storage/questions/images/Sport 235.jpg,,,1,129049,0,,1,1
SPORTING QUESTION,NONE,"TEEN,ADULT",30,United States,"Prior to Barclaycard, who was the first official sponsor of the Premiership in 1992?",Cadbury,Carlsberg,Coca-Cola,Carling,(NULL),C,storage/questions/images/Sport 236.jpg,,,1,129057,0,,1,1
SPORTING QUESTION,NONE,"TEEN,ADULT",30,United States,The Potters is the nickname of which FA Premiership team?,Liverpool,Everton,QPR,Stoke City,(NULL),D,storage/questions/images/Sport 237.jpg,,,1,129065,0,,1,1
SPORTING QUESTION,NONE,"TEEN,ADULT",30,United States,When was the last 42-match Premiership season?,1994/95,1990/91,1992/93,1991/92,(NULL),A,storage/questions/images/Sport 238.jpg,,,1,129073,0,,1,1
SPORTING QUESTION,NONE,"TEEN,ADULT",30,United States,Which club has this Liverpool midfielder not played at?,Manchester City,West Ham,Aston Villa,Leeds United,(NULL),B,storage/questions/images/Sport 239.jpg,,,1,129081,0,,1,1
SPORTING QUESTION,NONE,"TEEN,ADULT",30,United States,"Which footballer has scored the most goals in a single Premiership season of 38 games (since 1995), with 32 goals?",Luis Suarez,Robin van Persie,Mohammed Salah,Cristiano Ronaldo,(NULL),C,storage/questions/images/Sport 240.jpg,,,1,129089,0,,1,1
SPORTING QUESTION,NONE,"TEEN,ADULT",30,United States,"Which footballler has won the most Premier League Golden Boots, since 1992, with a total of four?",Alan Shearer,Harry Kane,Michael Owen,Thierry Henry,(NULL),D,storage/questions/images/Sport 241.jpg,,,1,129097,0,,1,1
SPORTING QUESTION,NONE,"TEEN,ADULT",30,United States,Which Manchester United player was the first substitute to score four goals in a Premiership match?,Ole Gunnar Solskjaer,Andy Cole,David Beckham,Ryan Giggs,(NULL),A,storage/questions/images/Sport 242.jpg,,,1,129105,0,,1,1
SPORTING QUESTION,NONE,"TEEN,ADULT",30,United States,"Which of these Premiership teams suffered defeats of 8-0 and 9-1 in the 2009-10 season, with Jermain Defoe scoring here?",Portsmouth,Wigan Athletic,Hull City,Burnley,(NULL),B,storage/questions/images/Sport 243.jpg,,,1,129113,0,,1,1
SPORTING QUESTION,NONE,"TEEN,ADULT",30,United States,Which Premiership footballer has had the most appearances of 653?,James Milner,Ryan Giggs,Gareth Barry,Frank Lampard,(NULL),C,storage/questions/images/Sport 244.jpg,,,1,129121,0,,1,1
SPORTING QUESTION,NONE,"TEEN,ADULT",30,United States,Which Premiership striker won the Golden Boot for the 2019/2020 season?,Mohammed Salah,Bruno Fernandes,Pierre-Emerick Aubameyang,Harry Kane,(NULL),D,storage/questions/images/Sport 245.jpg,,,1,129129,0,,1,1
SPORTING QUESTION,NONE,"TEEN,ADULT",30,United States,"Which team first surpassed the record of 1,000 goals in the Premiership, in 2005?",Manchester United,Arsenal,Liverpool,Chelsea,(NULL),A,storage/questions/images/Sport 246.jpg,,,1,129137,0,,1,1
SPORTING QUESTION,NONE,"TEEN,ADULT",30,United States,Which team has NOT won a Premiership title?,Liverpool,Newcastle United,Leicester City,Blackburn Rovers,(NULL),B,storage/questions/images/Sport 247.jpg,,,1,129145,0,,1,1
SPORTING QUESTION,NONE,"TEEN,ADULT",30,United States,Which two players have won the Premiership Golden Boot over 3 consecutive years?,Alan Shearer & Michael Owen,Didier Drogba & Robin Van Persie,Thierry Henry & Alan Shearer,Harry Kane & Mohammed Salah,(NULL),C,storage/questions/images/Sport 248.jpg,,,1,129153,0,,1,1
SPORTING QUESTION,NONE,"TEEN,ADULT",30,United States,Who are the current FA Women's Super League champions?,Arsenal,Manchester City,Liverpool,Chelsea,(NULL),D,storage/questions/images/Sport 249.jpg,,,1,129161,0,,1,1
SPORTING QUESTION,NONE,"TEEN,ADULT",30,United States,"Who has NOT won the PFA Player of the Year, in the past 5 years?",Eden Hazard,Kevin De Bruyne,Virgil van Dijk,Mohamed Salah,(NULL),A,storage/questions/images/Sport 250.jpg,,,1,129169,0,,1,1
SPORTING QUESTION,NONE,JUNIOR,30,United States,All but which of the following are current Premiership grounds?,Old Trafford,Craven Cottage,Stamford Bridge,Anfield,(NULL),B,storage/questions/images/Sport 251.jpg,,,1,129177,0,,1,1
SPORTING QUESTION,NONE,"TEEN,ADULT",30,United States,"All but which of the following players won either the Golden Boot, Golden Ball or Golden Gloves at the 2018 FIFA World Cup?",Harry Kane,Luka Modric,Kylian Mbappe,Thibaut Courtois,(NULL),C,storage/questions/images/Sport 252.jpg,,,1,129181,0,,1,1
SPORTING QUESTION,NONE,JUNIOR,30,United States,Old Trafford is what English football club's home stadium?,Manchester City,Chelsea,Arsenal,Manchester United,(NULL),D,storage/questions/images/Sport 253.jpg,,,1,129189,0,,1,1
SPORTING QUESTION,NONE,JUNIOR,30,United States,Who won the Premiership three times in a row between 1999 and 2001?,Manchester United,Arsenal,Chelsea,Blackburn Rovers,(NULL),A,,,,0,129193,0,,1,1
SPORTING QUESTION,NONE,"TEEN,ADULT",30,United States,Which former England no.9 is the only one NOT to have scored 5 goals in a single game?,Jermain Defoe,Robbie Fowler,Malcolm Macdonald,Andy Cole,,B,storage/questions/images/Sport 255.jpg,,,1,129197,0,,1,1
SPORTING QUESTION,NONE,"TEEN,ADULT",30,United States,"As of September 2021, all but which of the following teams are ranked in the top 3 of the world FIFA rankings?",England,Belgium,Italy,Brazil,(NULL),C,storage/questions/images/Sport 256.jpg,,,1,129205,0,,1,1
SPORTING QUESTION,NONE,"TEEN,ADULT",30,United States,What's the name of the current President of FIFA?,Sepp Blatter,Issa Hayatou,Joao Havelange,Gianni Infantino,(NULL),D,storage/questions/images/Sport 257.jpg,,,1,129213,0,,1,1
SPORTING QUESTION,NONE,"TEEN,ADULT",30,United States,How many teams will compete at the 2026 FIFA World Cup finals?,48,32,40,24,,A,storage/questions/images/Sport 258.jpg,,,1,129221,0,,1,1
SPORTING QUESTION,NONE,"TEEN,ADULT",30,United States,Which country will not host any of the 2026 FIFA World Cup?,Mexico,Venezuela,Canada,United States,(NULL),B,,,,0,129229,0,,1,1
SPORTING QUESTION,NONE,"TEEN,ADULT",30,United States,Which of the following players has not won a FIFA World Cup Golden Ball?,Lionel Messi,Zinedine Zidane,Davor Suker,Romario,(NULL),C,storage/questions/images/Sport 260.jpg,,,1,129237,0,,1,1
SPORTING QUESTION,NONE,"TEEN,ADULT",30,United States,"Which season did Leeds United reach the European Cup final, captained by Billy Bremner (left)?",1972/1973,1977/1978,1969/1970,1974/1975,,D,storage/questions/images/Sport 261.jpg,,,1,129245,0,,1,1
SPORTING QUESTION,NONE,"TEEN,ADULT",30,United States,"Which team has never won the Champions League (European Cup), having been in 3 finals?",Atletico Madrid,Manchester City,Paris Saint-Germain,Porto,(NULL),A,storage/questions/images/Sport 262.jpg,,,1,129253,0,,1,1
SPORTING QUESTION,NONE,"TEEN,ADULT",30,United States,"Which team has NOT won a FIFA World Cup they have hosted, when Italy were the eventual winners?",France,Germany,Argentina,England,(NULL),B,storage/questions/images/Sport 263.jpg,,,1,129261,0,,1,1
SPORTING QUESTION,NONE,"TEEN,ADULT",30,United States,Which team has NOT won the Champions League (European Cup) 6 times or more?,Liverpool,Real Madrid,Barcelona,AC Milan,(NULL),C,storage/questions/images/Sport 264.jpg,,,1,129269,0,,1,1
SPORTING QUESTION,NONE,"TEEN,ADULT",30,United States,Who is the only team NOT to have beaten Real Madrid in a Champions League (European Cup) final?,Liverpool,Benfica,Inter Milan,Juventus,(NULL),D,storage/questions/images/Sport 265.jpg,,,1,129277,0,,1,1
SPORTING QUESTION,NONE,"TEEN,ADULT",30,United States,Who scored Arsenal's only goal in the 2006 Champions League Final against Barcelona?,Sol Campbell,Thierry Henry,Fredrik Ljungberg,Alexander Hleb,(NULL),A,storage/questions/images/Rhm6f1634737506976.jpg,,,1,129285,0,,1,1
SPORTING QUESTION,NONE,"TEEN,ADULT",30,United States,Who was the most recent team to win two FIFA World Cups?,Spain,France,Italy,Germany,(NULL),B,storage/questions/images/Sport 267.jpg,,,1,129293,0,,1,1
SPORTING QUESTION,NONE,"TEEN,ADULT",30,United States,"Who's the all-time top scorer at FIFA World Cups, with 16 goals?",Ronaldo,Jurgen Klinsmann,Miroslav Klose,Gerd Muller,,C,storage/questions/images/Sport 268.jpg,,,1,129301,0,,1,1
SPORTING QUESTION,NONE,JUNIOR,30,United States,All but which of the following are songs created for the England football team?,Three Lions,World in Motion,Vindaloo,Bittersweet Symphony,(NULL),D,storage/questions/images/Sport 269.jpg,,,1,129309,0,,1,1
SPORTING QUESTION,NONE,JUNIOR,30,United States,Paul Scholes made over 130 appearances in the Champions League for which team?,Manchester United,Chelsea,Arsenal,Liverpool,(NULL),A,storage/questions/images/Sport 270.jpg,,,1,129313,0,,1,1
SPORTING QUESTION,NONE,JUNIOR,30,United States,"What is the name of this trophy, awarded to FIFA World Cup winners, every 4 years?",Heisman Trophy,Jules Rimet,Borg-Warner Trophy,Silvio Gazzaniga,(NULL),B,storage/questions/images/Sport 271.jpg,,,1,129317,0,,1,1
SPORTING QUESTION,NONE,JUNIOR,30,United States,When did England win the World Cup?,1958,1996,1966,1974,(NULL),C,storage/questions/images/Sport 272.jpg,,,1,129321,0,,1,1
SPORTING QUESTION,NONE,JUNIOR,30,United States,"Where is the 2022 World Cup due to be staged, in the winter of 2022?",New Zealand,Russia,Australia,Qatar,(NULL),D,storage/questions/images/Sport 273.jpg,,,1,129325,0,,1,1
SPORTING QUESTION,NONE,JUNIOR,30,United States,"With 135 goals, who is the Champions League all-time top scorer?",Christiano Ronaldo,Lionel Messi,Karim Benzema,Thomas Muller,(NULL),A,storage/questions/images/Sport 274.jpg,,,1,129329,0,,1,1
SPORTING QUESTION,NONE,ADULT,30,United States,Which former Liverpool F.C. manager is represented with this statue?,Bob Paisley,Bill Shankly,Kenny Dalglish,Rafa Benitez,(NULL),B,storage/questions/images/Sport 275.jpg,,,1,129333,0,,1,1
SPORTING QUESTION,NONE,ADULT,30,United States,In what season did Blackburn Rovers win the English Premier League?,1992/93,1993/94,1994/95,1991/92,(NULL),C,storage/questions/images/Sport 276.jpg,,,1,129337,0,,1,1
SPORTING QUESTION,NONE,ADULT,30,United States,Who has taken this penalty kick?,Raheem Sterling,Jesse Lingard,Marcus Rashford,Bruno Fernandes,(NULL),D,storage/questions/images/Sport 277.jpg,,,1,129341,0,,1,1
SPORTING QUESTION,NONE,ADULT,30,United States,In which season did Charlton Athletic last get relegated from the English Premier League?,2006/07,1998/99,2001/02,2015/16,(NULL),A,storage/questions/images/Sport 278.jpg,,,1,129345,0,,1,1
SPORTING QUESTION,NONE,"TEEN,ADULT",30,United States,Which team's supporters are shown here?,FC Bayern Munich,Cologne FC,FC Red Bull Salzburg,Benfica FC,(NULL),B,storage/questions/images/Sport 279.jpg,,,1,129349,0,,1,1
SPORTING QUESTION,NONE,JUNIOR,30,United States,Which player is shown here (left)?,Takumi Minamino,Curtis Jones,Diogo Jota,Harvey Elliott,(NULL),C,storage/questions/images/Sport 280.jpg,,,1,129357,0,,1,1
SPORTING QUESTION,NONE,"TEEN,ADULT",30,United States,"Typically, how many pentagons and hexagons are there in total on a football?",64,24,40,32,(NULL),D,storage/questions/images/Sport 281.jpg,,,1,129361,0,,1,1
SPORTING QUESTION,NONE,"TEEN,ADULT",30,United States,What is the width of an regulation-size football goal?,8 yards,6 yards,10 yards,7.32 yards,(NULL),A,storage/questions/images/Sport 282.jpg,,,1,129369,0,,1,1
SPORTING QUESTION,NONE,"TEEN,ADULT",30,United States,Which women's international football team is shown here?,Croatia,USA,Canada,Poland,(NULL),B,storage/questions/images/Sport 283.jpg,,,1,129377,0,,1,1
SPORTING QUESTION,NONE,JUNIOR,30,United States,"How many minutes are there in a professional football match, without any added time?",45,120,90,60,(NULL),C,storage/questions/images/lUOSw1634737024421.jpg,,,1,129385,0,,1,1
SPORTING QUESTION,NONE,"JUNIOR,TEEN,ADULT",30,United States,"Including substitutes, how many players are eligible to take part in a Premier League football match?",11,22,20,40,,D,storage/questions/images/qpYwi1634736925491.jpg,,,1,129389,0,,1,1
SPORTING QUESTION,NONE,JUNIOR,30,United States,"When a player places the ball here in football, what kind of kick is he/she about to take?",Corner kick,Penalty,Free kick,Kick-off,(NULL),A,storage/questions/images/Sport 286.jpg,,,1,129401,0,,1,1
SPORTING QUESTION,NONE,ADULT,30,United States,Which famous footballer is this?,Juan Mata,Gary Cahill,John Terry,John Stones,(NULL),B,storage/questions/images/Sport 287.jpg,,,1,129405,0,,1,1
SPORTING QUESTION,NONE,ADULT,30,United States,Which football club is James Hanson seen playing for here?,Colchester United,Bradford City,Grimsby Town,Sheffiled United,(NULL),C,storage/questions/images/Sport 288.jpg,,,1,129409,0,,1,1
SPORTING QUESTION,NONE,ADULT,30,United States,Which team has the manager shown here NOT managed?,Borussia Dortmund,Liverpool F.C.,FSV Mainz 05,Bayern Munich,(NULL),D,storage/questions/images/Sport 289.jpg,,,1,129413,0,,1,1
SPORTING QUESTION,NONE,"JUNIOR,TEEN,ADULT",30,United States,Which footballing legend is pictured here?,Kenny Dalglish,Kevin Keegan,Bobby Charlton,Nobby Stiles,(NULL),A,storage/questions/images/Sport 290.jpg,,,1,129417,0,,1,1
SPORTING QUESTION,NONE,"TEEN,ADULT",30,United States,Which Italian football team do these fans support?,Napoli,Lazio,Sampdoria,Juventus,(NULL),B,storage/questions/images/Sport 291.jpg,,,1,129429,0,,1,1
