CATEGORY,SUBCATEGORY,AGE,TIMEALLOWED,REGION,QUESTION,ANSWER1,ANSWER2,ANSWER3,ANSWER4,HINT,CORRECTANSWER,IMAGEURL,VIDEOURL,SOUNDURL,FILETYPE,questionMasterId ,status,creditBy,questionActiveStatus,questionState
BREAKING NEWS,NONE,"JUNIOR,TEEN,ADULT",30,United Kingdom,"In a bid to ease overcrowding, Venice announced that it would be the first city in the world to trial what, from June 2022 onwards?",Inflatable bridges,Social distancing throughout,10 Euro entry fee,Free gondala rides,"Free gondola rides would increase the size of crowds, social distancing everywhere is impossible to enforce, and we strongly advise against crossing ANY inflatable bridges!",C,ZrOUW1651082245005.jpg,,,1,177705,0,,1,1
BREAKING NEWS,NONE,"JUNIOR,TEEN,ADULT",30,United Kingdom,"In April, Harry Styles and Lizzo performed a rendition of which One Direction hit, at Coachella?",Story of My Life,Perfect,What Makes You Beautiful,One Way or Another,,C,2JUXf1651082664273.jpg,,,1,177738,0,,1,1
BREAKING NEWS,NONE,"TEEN,ADULT",30,United Kingdom,"Located beneath the French-Swiss border, which powerful accelerator, that boosts particles to a speed close to that of light, forming all the matter we know, was recently re-opened after a 3-year hiatus?",Higgs Boson,CERN Accelerator,Alps Proton,Large Hadron Collider,,D,CxKnx1651083360826.jpg,,,1,177774,0,,1,1
BREAKING NEWS,NONE,"TEEN,ADULT",30,United Kingdom,"Which singer or group filmed their latest music video in Kyiv, Ukraine, days before Russia invaded the country?",Justin Bieber,The Chainsmokers,Maroon 5,Ed Sheeran,Ed's left arm tattoos were the giveaway!,D,Tb2Gt1651162893549.jpg,,,1,177802,0,,1,1
BREAKING NEWS,NONE,"TEEN,ADULT",30,United Kingdom,"In front of a record 94,000 crowd, what punch did Tyson Fury land to knock-out Dillian Whyte in the sixth-round, to retain his heavyweight titles, in April 2022?",Straight right (cross),Uppercut,Jab,Hook,,B,bE9Yo1651163373914.jpg,,,1,177826,0,,1,1
BREAKING NEWS,NONE,ADULT,30,United Kingdom,"A blue and white gingham print dress worn by which star of a 1939 classic film, is expected to sell for up to Dollar 1.2m (pound935,000) at a Bonhams auction, on May 24th 2022?",Judy Garland,Vivien Leigh,Lauren Bacall,Ingrid Bergman,Judy Garland wore the dress playing the role of Dorothy Gale in 'The Wizard of Oz'!,A,p7jRe1651163839968.jpg,,,1,177850,0,,1,1
BREAKING NEWS,NONE,"TEEN,ADULT",30,United Kingdom,"George Ezra teamed up with YouTube to give an pound85,000 donation, to plant 17,000 trees across the UK, which he hopes will help fight climate change and environmental decline, to which charity?",National Trust,RSPB,Royal Horticultural Society,Woodland Trust,,A,SjxPL1651164250211.jpg,,,1,177862,0,,1,1
